Running "module reset". Resetting modules to system default. The following $MODULEPATH directories have been removed: None
WARNING:__main__:
*****************************************
Setting OMP_NUM_THREADS environment variable for each process to be 1 in default, to avoid your system being overloaded, please further tune the variable for optimal performance in your application as needed. 
*****************************************
/u/choprahetarth/all_files/starcoder2
I am loading LORA
Loading BNB
Loading Model
/u/choprahetarth/all_files/starcoder2
I am loading LORA
Loading BNB
Loading Model
/u/choprahetarth/all_files/starcoder2
I am loading LORA
Loading BNB
Loading Model
/u/choprahetarth/all_files/starcoder2
I am loading LORA
Loading BNB
Loading Model
loading configuration file config.json from cache at /scratch/bbvz/choprahetarth/hub/models--meta-llama--CodeLlama-7b-hf/snapshots/b462c3c99b077d341db691ec780a33156f3c1472/config.json
loading configuration file config.json from cache at /scratch/bbvz/choprahetarth/hub/models--meta-llama--CodeLlama-7b-hf/snapshots/b462c3c99b077d341db691ec780a33156f3c1472/config.json
Model config LlamaConfig {
  "_name_or_path": "meta-llama/CodeLlama-7b-hf",
  "architectures": [
    "LlamaForCausalLM"
  ],
  "attention_bias": false,
  "attention_dropout": 0.0,
  "bos_token_id": 1,
  "eos_token_id": 2,
  "hidden_act": "silu",
  "hidden_size": 4096,
  "initializer_range": 0.02,
  "intermediate_size": 11008,
  "max_position_embeddings": 16384,
  "mlp_bias": false,
  "model_type": "llama",
  "num_attention_heads": 32,
  "num_hidden_layers": 32,
  "num_key_value_heads": 32,
  "pretraining_tp": 1,
  "rms_norm_eps": 1e-05,
  "rope_scaling": null,
  "rope_theta": 1000000,
  "tie_word_embeddings": false,
  "torch_dtype": "bfloat16",
  "transformers_version": "4.41.2",
  "use_cache": true,
  "vocab_size": 32016
}

Model config LlamaConfig {
  "_name_or_path": "meta-llama/CodeLlama-7b-hf",
  "architectures": [
    "LlamaForCausalLM"
  ],
  "attention_bias": false,
  "attention_dropout": 0.0,
  "bos_token_id": 1,
  "eos_token_id": 2,
  "hidden_act": "silu",
  "hidden_size": 4096,
  "initializer_range": 0.02,
  "intermediate_size": 11008,
  "max_position_embeddings": 16384,
  "mlp_bias": false,
  "model_type": "llama",
  "num_attention_heads": 32,
  "num_hidden_layers": 32,
  "num_key_value_heads": 32,
  "pretraining_tp": 1,
  "rms_norm_eps": 1e-05,
  "rope_scaling": null,
  "rope_theta": 1000000,
  "tie_word_embeddings": false,
  "torch_dtype": "bfloat16",
  "transformers_version": "4.41.2",
  "use_cache": true,
  "vocab_size": 32016
}

loading configuration file config.json from cache at /scratch/bbvz/choprahetarth/hub/models--meta-llama--CodeLlama-7b-hf/snapshots/b462c3c99b077d341db691ec780a33156f3c1472/config.json
Model config LlamaConfig {
  "_name_or_path": "meta-llama/CodeLlama-7b-hf",
  "architectures": [
    "LlamaForCausalLM"
  ],
  "attention_bias": false,
  "attention_dropout": 0.0,
  "bos_token_id": 1,
  "eos_token_id": 2,
  "hidden_act": "silu",
  "hidden_size": 4096,
  "initializer_range": 0.02,
  "intermediate_size": 11008,
  "max_position_embeddings": 16384,
  "mlp_bias": false,
  "model_type": "llama",
  "num_attention_heads": 32,
  "num_hidden_layers": 32,
  "num_key_value_heads": 32,
  "pretraining_tp": 1,
  "rms_norm_eps": 1e-05,
  "rope_scaling": null,
  "rope_theta": 1000000,
  "tie_word_embeddings": false,
  "torch_dtype": "bfloat16",
  "transformers_version": "4.41.2",
  "use_cache": true,
  "vocab_size": 32016
}

loading configuration file config.json from cache at /scratch/bbvz/choprahetarth/hub/models--meta-llama--CodeLlama-7b-hf/snapshots/b462c3c99b077d341db691ec780a33156f3c1472/config.json
Model config LlamaConfig {
  "_name_or_path": "meta-llama/CodeLlama-7b-hf",
  "architectures": [
    "LlamaForCausalLM"
  ],
  "attention_bias": false,
  "attention_dropout": 0.0,
  "bos_token_id": 1,
  "eos_token_id": 2,
  "hidden_act": "silu",
  "hidden_size": 4096,
  "initializer_range": 0.02,
  "intermediate_size": 11008,
  "max_position_embeddings": 16384,
  "mlp_bias": false,
  "model_type": "llama",
  "num_attention_heads": 32,
  "num_hidden_layers": 32,
  "num_key_value_heads": 32,
  "pretraining_tp": 1,
  "rms_norm_eps": 1e-05,
  "rope_scaling": null,
  "rope_theta": 1000000,
  "tie_word_embeddings": false,
  "torch_dtype": "bfloat16",
  "transformers_version": "4.41.2",
  "use_cache": true,
  "vocab_size": 32016
}

Overriding torch_dtype=None with `torch_dtype=torch.float16` due to requirements of `bitsandbytes` to enable model loading in 8-bit or 4-bit. Pass your own torch_dtype to specify the dtype of the remaining non-linear layers or pass torch_dtype=torch.float16 to remove this warning.
Overriding torch_dtype=None with `torch_dtype=torch.float16` due to requirements of `bitsandbytes` to enable model loading in 8-bit or 4-bit. Pass your own torch_dtype to specify the dtype of the remaining non-linear layers or pass torch_dtype=torch.float16 to remove this warning.
Overriding torch_dtype=None with `torch_dtype=torch.float16` due to requirements of `bitsandbytes` to enable model loading in 8-bit or 4-bit. Pass your own torch_dtype to specify the dtype of the remaining non-linear layers or pass torch_dtype=torch.float16 to remove this warning.
Overriding torch_dtype=None with `torch_dtype=torch.float16` due to requirements of `bitsandbytes` to enable model loading in 8-bit or 4-bit. Pass your own torch_dtype to specify the dtype of the remaining non-linear layers or pass torch_dtype=torch.float16 to remove this warning.
loading weights file model.safetensors from cache at /scratch/bbvz/choprahetarth/hub/models--meta-llama--CodeLlama-7b-hf/snapshots/b462c3c99b077d341db691ec780a33156f3c1472/model.safetensors.index.json
Downloading shards:   0%|          | 0/2 [00:00<?, ?it/s]loading weights file model.safetensors from cache at /scratch/bbvz/choprahetarth/hub/models--meta-llama--CodeLlama-7b-hf/snapshots/b462c3c99b077d341db691ec780a33156f3c1472/model.safetensors.index.json
Downloading shards:   0%|          | 0/2 [00:00<?, ?it/s]loading weights file model.safetensors from cache at /scratch/bbvz/choprahetarth/hub/models--meta-llama--CodeLlama-7b-hf/snapshots/b462c3c99b077d341db691ec780a33156f3c1472/model.safetensors.index.json
Downloading shards:   0%|          | 0/2 [00:00<?, ?it/s]loading weights file model.safetensors from cache at /scratch/bbvz/choprahetarth/hub/models--meta-llama--CodeLlama-7b-hf/snapshots/b462c3c99b077d341db691ec780a33156f3c1472/model.safetensors.index.json
Downloading shards:   0%|          | 0/2 [00:00<?, ?it/s]Downloading shards:  50%|█████     | 1/2 [01:16<01:16, 76.39s/it]Downloading shards:  50%|█████     | 1/2 [01:16<01:16, 76.44s/it]Downloading shards:  50%|█████     | 1/2 [01:16<01:16, 76.52s/it]Downloading shards:  50%|█████     | 1/2 [01:16<01:16, 76.59s/it]Downloading shards: 100%|██████████| 2/2 [01:52<00:00, 52.90s/it]Downloading shards: 100%|██████████| 2/2 [01:52<00:00, 56.43s/it]
Instantiating LlamaForCausalLM model under default dtype torch.float16.
Generate config GenerationConfig {
  "bos_token_id": 1,
  "eos_token_id": 2
}

Downloading shards: 100%|██████████| 2/2 [01:52<00:00, 52.90s/it]Downloading shards: 100%|██████████| 2/2 [01:52<00:00, 56.44s/it]
Instantiating LlamaForCausalLM model under default dtype torch.float16.
Generate config GenerationConfig {
  "bos_token_id": 1,
  "eos_token_id": 2
}

Downloading shards: 100%|██████████| 2/2 [01:52<00:00, 52.92s/it]Downloading shards: 100%|██████████| 2/2 [01:52<00:00, 56.47s/it]
Instantiating LlamaForCausalLM model under default dtype torch.float16.
Generate config GenerationConfig {
  "bos_token_id": 1,
  "eos_token_id": 2
}

Downloading shards: 100%|██████████| 2/2 [01:52<00:00, 52.94s/it]Downloading shards: 100%|██████████| 2/2 [01:52<00:00, 56.46s/it]
Instantiating LlamaForCausalLM model under default dtype torch.float16.
Generate config GenerationConfig {
  "bos_token_id": 1,
  "eos_token_id": 2
}

Loading checkpoint shards:   0%|          | 0/2 [00:00<?, ?it/s]Loading checkpoint shards:   0%|          | 0/2 [00:00<?, ?it/s]Loading checkpoint shards:   0%|          | 0/2 [00:00<?, ?it/s]Loading checkpoint shards:   0%|          | 0/2 [00:00<?, ?it/s]Loading checkpoint shards:  50%|█████     | 1/2 [00:08<00:08,  8.78s/it]Loading checkpoint shards:  50%|█████     | 1/2 [00:09<00:09,  9.54s/it]Loading checkpoint shards:  50%|█████     | 1/2 [00:09<00:09,  9.59s/it]Loading checkpoint shards:  50%|█████     | 1/2 [00:09<00:09,  9.63s/it]Loading checkpoint shards: 100%|██████████| 2/2 [00:11<00:00,  5.41s/it]Loading checkpoint shards: 100%|██████████| 2/2 [00:11<00:00,  5.91s/it]
All model checkpoint weights were used when initializing LlamaForCausalLM.

All the weights of LlamaForCausalLM were initialized from the model checkpoint at meta-llama/CodeLlama-7b-hf.
If your task is similar to the task the model of the checkpoint was trained on, you can already use LlamaForCausalLM for predictions without further training.
loading configuration file generation_config.json from cache at /scratch/bbvz/choprahetarth/hub/models--meta-llama--CodeLlama-7b-hf/snapshots/b462c3c99b077d341db691ec780a33156f3c1472/generation_config.json
Generate config GenerationConfig {
  "bos_token_id": 1,
  "eos_token_id": 2
}

Model Loaded
Loading checkpoint shards: 100%|██████████| 2/2 [00:12<00:00,  5.81s/it]Loading checkpoint shards: 100%|██████████| 2/2 [00:12<00:00,  6.37s/it]
All model checkpoint weights were used when initializing LlamaForCausalLM.

All the weights of LlamaForCausalLM were initialized from the model checkpoint at meta-llama/CodeLlama-7b-hf.
If your task is similar to the task the model of the checkpoint was trained on, you can already use LlamaForCausalLM for predictions without further training.
Loading checkpoint shards: 100%|██████████| 2/2 [00:12<00:00,  5.87s/it]Loading checkpoint shards: 100%|██████████| 2/2 [00:12<00:00,  6.44s/it]
All model checkpoint weights were used when initializing LlamaForCausalLM.

All the weights of LlamaForCausalLM were initialized from the model checkpoint at meta-llama/CodeLlama-7b-hf.
If your task is similar to the task the model of the checkpoint was trained on, you can already use LlamaForCausalLM for predictions without further training.
loading configuration file generation_config.json from cache at /scratch/bbvz/choprahetarth/hub/models--meta-llama--CodeLlama-7b-hf/snapshots/b462c3c99b077d341db691ec780a33156f3c1472/generation_config.json
Generate config GenerationConfig {
  "bos_token_id": 1,
  "eos_token_id": 2
}

Setting num_proc from 64 back to 1 for the train split to disable multiprocessing as it only contains one shard.
Generating train split: 0 examples [00:00, ? examples/s]Loading checkpoint shards: 100%|██████████| 2/2 [00:12<00:00,  5.87s/it]Loading checkpoint shards: 100%|██████████| 2/2 [00:12<00:00,  6.43s/it]
All model checkpoint weights were used when initializing LlamaForCausalLM.

All the weights of LlamaForCausalLM were initialized from the model checkpoint at meta-llama/CodeLlama-7b-hf.
If your task is similar to the task the model of the checkpoint was trained on, you can already use LlamaForCausalLM for predictions without further training.
Model Loaded
loading configuration file generation_config.json from cache at /scratch/bbvz/choprahetarth/hub/models--meta-llama--CodeLlama-7b-hf/snapshots/b462c3c99b077d341db691ec780a33156f3c1472/generation_config.json
Generate config GenerationConfig {
  "bos_token_id": 1,
  "eos_token_id": 2
}

loading configuration file generation_config.json from cache at /scratch/bbvz/choprahetarth/hub/models--meta-llama--CodeLlama-7b-hf/snapshots/b462c3c99b077d341db691ec780a33156f3c1472/generation_config.json
Generate config GenerationConfig {
  "bos_token_id": 1,
  "eos_token_id": 2
}

Model Loaded
Model Loaded
Generating train split: 15246 examples [00:00, 71829.83 examples/s]Generating train split: 15246 examples [00:00, 71296.13 examples/s]
Map:   0%|          | 0/15246 [00:00<?, ? examples/s]Map:   0%|          | 0/15246 [00:00<?, ? examples/s]Map:   0%|          | 0/15246 [00:00<?, ? examples/s]Map:   0%|          | 0/15246 [00:00<?, ? examples/s]Map:  14%|█▁        | 2140/15246 [00:00<00:00, 20999.04 examples/s]Map:  14%|█▁        | 2164/15246 [00:00<00:00, 21520.62 examples/s]Map:  15%|█▁        | 2212/15246 [00:00<00:00, 21993.86 examples/s]Map:  14%|█▁        | 2192/15246 [00:00<00:00, 21773.73 examples/s]Map:  29%|██▉       | 4484/15246 [00:00<00:00, 22417.66 examples/s]Map:  29%|██▉       | 4480/15246 [00:00<00:00, 22479.95 examples/s]Map:  30%|███       | 4574/15246 [00:00<00:00, 22943.48 examples/s]Map:  29%|██▉       | 4484/15246 [00:00<00:00, 22440.20 examples/s]Map:  45%|████▁     | 6835/15246 [00:00<00:00, 22911.01 examples/s]Map:  45%|████▁     | 6787/15246 [00:00<00:00, 22743.57 examples/s]Map:  46%|████▌     | 6938/15246 [00:00<00:00, 23255.28 examples/s]Map:  45%|████▁     | 6803/15246 [00:00<00:00, 22781.05 examples/s]Map:  60%|█████▉    | 9145/15246 [00:00<00:00, 22979.15 examples/s]Map:  59%|█████▉    | 9063/15246 [00:00<00:00, 22744.71 examples/s]Map:  61%|██████    | 9281/15246 [00:00<00:00, 23323.85 examples/s]Map:  75%|███████▌  | 11480/15246 [00:00<00:00, 23107.10 examples/s]Map:  75%|███████▁  | 11387/15246 [00:00<00:00, 22921.63 examples/s]Map:  67%|██████▋   | 10238/15246 [00:00<00:00, 22837.15 examples/s]Map:  77%|███████▋  | 11668/15246 [00:00<00:00, 23516.21 examples/s]Map:  91%|█████████ | 13804/15246 [00:00<00:00, 23150.93 examples/s]Map:  90%|█████████ | 13725/15246 [00:00<00:00, 23074.36 examples/s]Map:  82%|████████▁ | 12563/15246 [00:00<00:00, 22966.11 examples/s]Map: 100%|██████████| 15246/15246 [00:00<00:00, 22718.57 examples/s]
Map: 100%|█████████▉| 15201/15246 [00:00<00:00, 23528.17 examples/s]Map: 100%|██████████| 15246/15246 [00:00<00:00, 23141.49 examples/s]
Map: 100%|██████████| 15246/15246 [00:00<00:00, 21409.53 examples/s]
Sample from the training dataset:  {'prompt': 'Given this Ansible Name Field, please generate the ansible task. name: Ensure fail2ban service is enabled and started', 'completion': 'service:\n  name: fail2ban\n  state: started\n  enabled: true\nwhen: centos_base_fail2ban_configuration|bool\n'}
Map:  98%|█████████▊| 14871/15246 [00:00<00:00, 23000.38 examples/s]PyTorch: setting up devices
Sample from the training dataset:  {'prompt': 'Given this Ansible Name Field, please generate the ansible task. name: Ensure fail2ban service is enabled and started', 'completion': 'service:\n  name: fail2ban\n  state: started\n  enabled: true\nwhen: centos_base_fail2ban_configuration|bool\n'}
PyTorch: setting up devices
Map: 100%|██████████| 15246/15246 [00:00<00:00, 22623.23 examples/s]
Sample from the training dataset:  {'prompt': 'Given this Ansible Name Field, please generate the ansible task. name: Ensure fail2ban service is enabled and started', 'completion': 'service:\n  name: fail2ban\n  state: started\n  enabled: true\nwhen: centos_base_fail2ban_configuration|bool\n'}
PyTorch: setting up devices
/u/choprahetarth/.conda/envs/scoder_2/lib/python3.12/site-packages/huggingface_hub/utils/_deprecation.py:100: FutureWarning: Deprecated argument(s) used in '__init__': max_seq_length. Will not be supported from version '1.0.0'.

Deprecated positional argument(s) used in SFTTrainer, please use the SFTConfig to set these arguments instead.
  warnings.warn(message, FutureWarning)
PyTorch: setting up devices
/u/choprahetarth/.conda/envs/scoder_2/lib/python3.12/site-packages/huggingface_hub/utils/_deprecation.py:100: FutureWarning: Deprecated argument(s) used in '__init__': max_seq_length. Will not be supported from version '1.0.0'.

Deprecated positional argument(s) used in SFTTrainer, please use the SFTConfig to set these arguments instead.
  warnings.warn(message, FutureWarning)
PyTorch: setting up devices
/u/choprahetarth/.conda/envs/scoder_2/lib/python3.12/site-packages/huggingface_hub/utils/_deprecation.py:100: FutureWarning: Deprecated argument(s) used in '__init__': max_seq_length. Will not be supported from version '1.0.0'.

Deprecated positional argument(s) used in SFTTrainer, please use the SFTConfig to set these arguments instead.
  warnings.warn(message, FutureWarning)
PyTorch: setting up devices
/u/choprahetarth/.conda/envs/scoder_2/lib/python3.12/site-packages/transformers/training_args.py:1965: FutureWarning: `--push_to_hub_token` is deprecated and will be removed in version 5 of 🤗 Transformers. Use `--hub_token` instead.
  warnings.warn(
/u/choprahetarth/.conda/envs/scoder_2/lib/python3.12/site-packages/transformers/training_args.py:1965: FutureWarning: `--push_to_hub_token` is deprecated and will be removed in version 5 of 🤗 Transformers. Use `--hub_token` instead.
  warnings.warn(
/u/choprahetarth/.conda/envs/scoder_2/lib/python3.12/site-packages/transformers/training_args.py:1965: FutureWarning: `--push_to_hub_token` is deprecated and will be removed in version 5 of 🤗 Transformers. Use `--hub_token` instead.
  warnings.warn(
PyTorch: setting up devices
PyTorch: setting up devices
PyTorch: setting up devices
/u/choprahetarth/.conda/envs/scoder_2/lib/python3.12/site-packages/transformers/training_args.py:1965: FutureWarning: `--push_to_hub_token` is deprecated and will be removed in version 5 of 🤗 Transformers. Use `--hub_token` instead.
  warnings.warn(
/u/choprahetarth/.conda/envs/scoder_2/lib/python3.12/site-packages/transformers/training_args.py:1965: FutureWarning: `--push_to_hub_token` is deprecated and will be removed in version 5 of 🤗 Transformers. Use `--hub_token` instead.
  warnings.warn(
/u/choprahetarth/.conda/envs/scoder_2/lib/python3.12/site-packages/transformers/training_args.py:1965: FutureWarning: `--push_to_hub_token` is deprecated and will be removed in version 5 of 🤗 Transformers. Use `--hub_token` instead.
  warnings.warn(
Sample from the training dataset:  {'prompt': 'Given this Ansible Name Field, please generate the ansible task. name: Ensure fail2ban service is enabled and started', 'completion': 'service:\n  name: fail2ban\n  state: started\n  enabled: true\nwhen: centos_base_fail2ban_configuration|bool\n'}
PyTorch: setting up devices
/u/choprahetarth/.conda/envs/scoder_2/lib/python3.12/site-packages/huggingface_hub/utils/_deprecation.py:100: FutureWarning: Deprecated argument(s) used in '__init__': max_seq_length. Will not be supported from version '1.0.0'.

Deprecated positional argument(s) used in SFTTrainer, please use the SFTConfig to set these arguments instead.
  warnings.warn(message, FutureWarning)
PyTorch: setting up devices
/u/choprahetarth/.conda/envs/scoder_2/lib/python3.12/site-packages/transformers/training_args.py:1965: FutureWarning: `--push_to_hub_token` is deprecated and will be removed in version 5 of 🤗 Transformers. Use `--hub_token` instead.
  warnings.warn(
PyTorch: setting up devices
/u/choprahetarth/.conda/envs/scoder_2/lib/python3.12/site-packages/transformers/training_args.py:1965: FutureWarning: `--push_to_hub_token` is deprecated and will be removed in version 5 of 🤗 Transformers. Use `--hub_token` instead.
  warnings.warn(
loading file tokenizer.model from cache at /scratch/bbvz/choprahetarth/hub/models--meta-llama--CodeLlama-7b-hf/snapshots/b462c3c99b077d341db691ec780a33156f3c1472/tokenizer.model
loading file tokenizer.json from cache at /scratch/bbvz/choprahetarth/hub/models--meta-llama--CodeLlama-7b-hf/snapshots/b462c3c99b077d341db691ec780a33156f3c1472/tokenizer.json
loading file added_tokens.json from cache at None
loading file special_tokens_map.json from cache at /scratch/bbvz/choprahetarth/hub/models--meta-llama--CodeLlama-7b-hf/snapshots/b462c3c99b077d341db691ec780a33156f3c1472/special_tokens_map.json
loading file tokenizer_config.json from cache at /scratch/bbvz/choprahetarth/hub/models--meta-llama--CodeLlama-7b-hf/snapshots/b462c3c99b077d341db691ec780a33156f3c1472/tokenizer_config.json
loading file tokenizer.model from cache at /scratch/bbvz/choprahetarth/hub/models--meta-llama--CodeLlama-7b-hf/snapshots/b462c3c99b077d341db691ec780a33156f3c1472/tokenizer.model
loading file tokenizer.json from cache at /scratch/bbvz/choprahetarth/hub/models--meta-llama--CodeLlama-7b-hf/snapshots/b462c3c99b077d341db691ec780a33156f3c1472/tokenizer.json
loading file added_tokens.json from cache at None
loading file special_tokens_map.json from cache at /scratch/bbvz/choprahetarth/hub/models--meta-llama--CodeLlama-7b-hf/snapshots/b462c3c99b077d341db691ec780a33156f3c1472/special_tokens_map.json
loading file tokenizer_config.json from cache at /scratch/bbvz/choprahetarth/hub/models--meta-llama--CodeLlama-7b-hf/snapshots/b462c3c99b077d341db691ec780a33156f3c1472/tokenizer_config.json
/u/choprahetarth/.conda/envs/scoder_2/lib/python3.12/site-packages/trl/trainer/sft_trainer.py:269: UserWarning: You passed a `max_seq_length` argument to the SFTTrainer, the value you passed will override the one in the `SFTConfig`.
  warnings.warn(
loading file tokenizer.model from cache at /scratch/bbvz/choprahetarth/hub/models--meta-llama--CodeLlama-7b-hf/snapshots/b462c3c99b077d341db691ec780a33156f3c1472/tokenizer.model
loading file tokenizer.json from cache at /scratch/bbvz/choprahetarth/hub/models--meta-llama--CodeLlama-7b-hf/snapshots/b462c3c99b077d341db691ec780a33156f3c1472/tokenizer.json
loading file added_tokens.json from cache at None
loading file special_tokens_map.json from cache at /scratch/bbvz/choprahetarth/hub/models--meta-llama--CodeLlama-7b-hf/snapshots/b462c3c99b077d341db691ec780a33156f3c1472/special_tokens_map.json
loading file tokenizer_config.json from cache at /scratch/bbvz/choprahetarth/hub/models--meta-llama--CodeLlama-7b-hf/snapshots/b462c3c99b077d341db691ec780a33156f3c1472/tokenizer_config.json
/u/choprahetarth/.conda/envs/scoder_2/lib/python3.12/site-packages/trl/trainer/sft_trainer.py:269: UserWarning: You passed a `max_seq_length` argument to the SFTTrainer, the value you passed will override the one in the `SFTConfig`.
  warnings.warn(
loading file tokenizer.model from cache at /scratch/bbvz/choprahetarth/hub/models--meta-llama--CodeLlama-7b-hf/snapshots/b462c3c99b077d341db691ec780a33156f3c1472/tokenizer.model
loading file tokenizer.json from cache at /scratch/bbvz/choprahetarth/hub/models--meta-llama--CodeLlama-7b-hf/snapshots/b462c3c99b077d341db691ec780a33156f3c1472/tokenizer.json
loading file added_tokens.json from cache at None
loading file special_tokens_map.json from cache at /scratch/bbvz/choprahetarth/hub/models--meta-llama--CodeLlama-7b-hf/snapshots/b462c3c99b077d341db691ec780a33156f3c1472/special_tokens_map.json
loading file tokenizer_config.json from cache at /scratch/bbvz/choprahetarth/hub/models--meta-llama--CodeLlama-7b-hf/snapshots/b462c3c99b077d341db691ec780a33156f3c1472/tokenizer_config.json
/u/choprahetarth/.conda/envs/scoder_2/lib/python3.12/site-packages/trl/trainer/sft_trainer.py:269: UserWarning: You passed a `max_seq_length` argument to the SFTTrainer, the value you passed will override the one in the `SFTConfig`.
  warnings.warn(
/u/choprahetarth/.conda/envs/scoder_2/lib/python3.12/site-packages/trl/trainer/sft_trainer.py:269: UserWarning: You passed a `max_seq_length` argument to the SFTTrainer, the value you passed will override the one in the `SFTConfig`.
  warnings.warn(
/u/choprahetarth/.conda/envs/scoder_2/lib/python3.12/site-packages/trl/trainer/sft_trainer.py:355: UserWarning: You passed a `dataset_kwargs` argument to the SFTTrainer, the value you passed will override the one in the `SFTConfig`.
  warnings.warn(
Map:   0%|          | 0/13721 [00:00<?, ? examples/s]No chat template is set for this tokenizer, falling back to a default class-level template. This is very error-prone, because models are often trained with templates different from the class default! Default chat templates are a legacy feature and will be removed in Transformers v4.43, at which point any code depending on them will stop working. We recommend setting a valid chat template before then to ensure that this model continues working without issues.
Map:   7%|▋         | 1000/13721 [00:00<00:02, 4581.85 examples/s]Map:  22%|██▁       | 3000/13721 [00:00<00:01, 8603.84 examples/s]Map:  36%|███▋      | 5000/13721 [00:00<00:00, 10426.38 examples/s]Map:  51%|█████     | 7000/13721 [00:00<00:00, 11372.14 examples/s]Map:  66%|██████▌   | 9000/13721 [00:00<00:00, 11830.46 examples/s]Map:  80%|████████  | 11000/13721 [00:00<00:00, 12483.92 examples/s]Map:  95%|█████████▁| 13000/13721 [00:01<00:00, 12701.99 examples/s]Map: 100%|██████████| 13721/13721 [00:01<00:00, 11432.96 examples/s]
Map:   0%|          | 0/1525 [00:00<?, ? examples/s]Map:  66%|██████▌   | 1000/1525 [00:00<00:00, 9085.74 examples/s]Map: 100%|██████████| 1525/1525 [00:00<00:00, 9932.41 examples/s]
/u/choprahetarth/.conda/envs/scoder_2/lib/python3.12/site-packages/trl/trainer/sft_trainer.py:355: UserWarning: You passed a `dataset_kwargs` argument to the SFTTrainer, the value you passed will override the one in the `SFTConfig`.
  warnings.warn(
/u/choprahetarth/.conda/envs/scoder_2/lib/python3.12/site-packages/trl/trainer/sft_trainer.py:355: UserWarning: You passed a `dataset_kwargs` argument to the SFTTrainer, the value you passed will override the one in the `SFTConfig`.
  warnings.warn(
/u/choprahetarth/.conda/envs/scoder_2/lib/python3.12/site-packages/trl/trainer/sft_trainer.py:355: UserWarning: You passed a `dataset_kwargs` argument to the SFTTrainer, the value you passed will override the one in the `SFTConfig`.
  warnings.warn(
/u/choprahetarth/.conda/envs/scoder_2/lib/python3.12/site-packages/trl/trainer/sft_trainer.py:397: UserWarning: You passed a tokenizer with `padding_side` not equal to `right` to the SFTTrainer. This might lead to some unexpected behaviour due to overflow issues when training a model in half-precision. You might consider adding `tokenizer.padding_side = 'right'` to your code.
  warnings.warn(
WARNING:accelerate.utils.other:Detected kernel version 4.18.0, which is below the recommended minimum of 5.5.0; this can cause the process to hang. It is recommended to upgrade the kernel to the minimum version or higher.
Map:   0%|          | 0/1525 [00:00<?, ? examples/s]Map:   0%|          | 0/1525 [00:00<?, ? examples/s]Map:   0%|          | 0/1525 [00:00<?, ? examples/s]No chat template is set for this tokenizer, falling back to a default class-level template. This is very error-prone, because models are often trained with templates different from the class default! Default chat templates are a legacy feature and will be removed in Transformers v4.43, at which point any code depending on them will stop working. We recommend setting a valid chat template before then to ensure that this model continues working without issues.
No chat template is set for this tokenizer, falling back to a default class-level template. This is very error-prone, because models are often trained with templates different from the class default! Default chat templates are a legacy feature and will be removed in Transformers v4.43, at which point any code depending on them will stop working. We recommend setting a valid chat template before then to ensure that this model continues working without issues.
No chat template is set for this tokenizer, falling back to a default class-level template. This is very error-prone, because models are often trained with templates different from the class default! Default chat templates are a legacy feature and will be removed in Transformers v4.43, at which point any code depending on them will stop working. We recommend setting a valid chat template before then to ensure that this model continues working without issues.
Map:  66%|██████▌   | 1000/1525 [00:00<00:00, 5798.07 examples/s]Map:  66%|██████▌   | 1000/1525 [00:00<00:00, 5515.66 examples/s]Map: 100%|██████████| 1525/1525 [00:00<00:00, 6735.41 examples/s]
/u/choprahetarth/.conda/envs/scoder_2/lib/python3.12/site-packages/trl/trainer/sft_trainer.py:397: UserWarning: You passed a tokenizer with `padding_side` not equal to `right` to the SFTTrainer. This might lead to some unexpected behaviour due to overflow issues when training a model in half-precision. You might consider adding `tokenizer.padding_side = 'right'` to your code.
  warnings.warn(
Map: 100%|██████████| 1525/1525 [00:00<00:00, 6562.31 examples/s]
/u/choprahetarth/.conda/envs/scoder_2/lib/python3.12/site-packages/trl/trainer/sft_trainer.py:397: UserWarning: You passed a tokenizer with `padding_side` not equal to `right` to the SFTTrainer. This might lead to some unexpected behaviour due to overflow issues when training a model in half-precision. You might consider adding `tokenizer.padding_side = 'right'` to your code.
  warnings.warn(
Map:  66%|██████▌   | 1000/1525 [00:00<00:00, 3036.49 examples/s]Map: 100%|██████████| 1525/1525 [00:00<00:00, 4030.10 examples/s]
/u/choprahetarth/.conda/envs/scoder_2/lib/python3.12/site-packages/trl/trainer/sft_trainer.py:397: UserWarning: You passed a tokenizer with `padding_side` not equal to `right` to the SFTTrainer. This might lead to some unexpected behaviour due to overflow issues when training a model in half-precision. You might consider adding `tokenizer.padding_side = 'right'` to your code.
  warnings.warn(
max_steps is given, it will override any value given in num_train_epochs
max_steps is given, it will override any value given in num_train_epochs
max_steps is given, it will override any value given in num_train_epochs
Training...
Training...
Training...
max_steps is given, it will override any value given in num_train_epochs
Using auto half precision backend
Training...
***** Running training *****
  Num examples = 13,721
  Num Epochs = 1
  Instantaneous batch size per device = 4
  Total train batch size (w. parallel, distributed & accumulation) = 16
  Gradient Accumulation steps = 1
  Total optimization steps = 100
  Number of trainable parameters = 39,976,960
Automatic Weights & Biases logging enabled, to disable set os.environ["WANDB_DISABLED"] = "true"
wandb: Currently logged in as: hetarthvader. Use `wandb login --relogin` to force relogin
wandb: Tracking run with wandb version 0.17.2
wandb: Run data is saved locally in /scratch/bbvz/choprahetarth/wandb/run-20240622_181751-bm44clz9
wandb: Run `wandb offline` to turn off syncing.
wandb: Syncing run train-CodeLlama-7b-hf
wandb: ⭐️ View project at https://wandb.ai/hetarthvader/huggingface
wandb: 🚀 View run at https://wandb.ai/hetarthvader/huggingface/runs/bm44clz9
  0%|          | 0/100 [00:00<?, ?it/s]/u/choprahetarth/.conda/envs/scoder_2/lib/python3.12/site-packages/bitsandbytes/autograd/_functions.py:316: UserWarning: MatMul8bitLt: inputs will be cast from torch.float32 to float16 during quantization
  warnings.warn(f"MatMul8bitLt: inputs will be cast from {A.dtype} to float16 during quantization")
/u/choprahetarth/.conda/envs/scoder_2/lib/python3.12/site-packages/bitsandbytes/autograd/_functions.py:316: UserWarning: MatMul8bitLt: inputs will be cast from torch.float32 to float16 during quantization
  warnings.warn(f"MatMul8bitLt: inputs will be cast from {A.dtype} to float16 during quantization")
/u/choprahetarth/.conda/envs/scoder_2/lib/python3.12/site-packages/bitsandbytes/autograd/_functions.py:316: UserWarning: MatMul8bitLt: inputs will be cast from torch.float32 to float16 during quantization
  warnings.warn(f"MatMul8bitLt: inputs will be cast from {A.dtype} to float16 during quantization")
/u/choprahetarth/.conda/envs/scoder_2/lib/python3.12/site-packages/bitsandbytes/autograd/_functions.py:316: UserWarning: MatMul8bitLt: inputs will be cast from torch.float32 to float16 during quantization
  warnings.warn(f"MatMul8bitLt: inputs will be cast from {A.dtype} to float16 during quantization")
[rank0]:[W reducer.cpp:1389] Warning: find_unused_parameters=True was specified in DDP constructor, but did not find any unused parameters in the forward pass. This flag results in an extra traversal of the autograd graph every iteration,  which can adversely affect performance. If your model indeed never has any unused parameters in the forward pass, consider turning this flag off. Note that this warning may be a false positive if your model has flow control causing later iterations to have unused parameters. (function operator())
[rank1]:[W reducer.cpp:1389] Warning: find_unused_parameters=True was specified in DDP constructor, but did not find any unused parameters in the forward pass. This flag results in an extra traversal of the autograd graph every iteration,  which can adversely affect performance. If your model indeed never has any unused parameters in the forward pass, consider turning this flag off. Note that this warning may be a false positive if your model has flow control causing later iterations to have unused parameters. (function operator())
[rank2]:[W reducer.cpp:1389] Warning: find_unused_parameters=True was specified in DDP constructor, but did not find any unused parameters in the forward pass. This flag results in an extra traversal of the autograd graph every iteration,  which can adversely affect performance. If your model indeed never has any unused parameters in the forward pass, consider turning this flag off. Note that this warning may be a false positive if your model has flow control causing later iterations to have unused parameters. (function operator())
[rank3]:[W reducer.cpp:1389] Warning: find_unused_parameters=True was specified in DDP constructor, but did not find any unused parameters in the forward pass. This flag results in an extra traversal of the autograd graph every iteration,  which can adversely affect performance. If your model indeed never has any unused parameters in the forward pass, consider turning this flag off. Note that this warning may be a false positive if your model has flow control causing later iterations to have unused parameters. (function operator())
{'loss': 2.7276, 'grad_norm': 0.34301966428756714, 'learning_rate': 1.6000000000000003e-05, 'epoch': 0.01}
  1%|          | 1/100 [00:04<06:59,  4.23s/it]  2%|▁         | 2/100 [00:05<03:56,  2.41s/it]  3%|▎         | 3/100 [00:07<03:42,  2.29s/it]  4%|▁         | 4/100 [00:08<03:01,  1.89s/it]  5%|▌         | 5/100 [00:11<03:33,  2.24s/it]  6%|▌         | 6/100 [00:13<03:11,  2.03s/it]  7%|▋         | 7/100 [00:14<02:42,  1.75s/it]  8%|▊         | 8/100 [00:15<02:18,  1.51s/it]  9%|▉         | 9/100 [00:16<02:14,  1.48s/it] 10%|█         | 10/100 [00:18<02:23,  1.60s/it]                                                 10%|█         | 10/100 [00:18<02:23,  1.60s/it] 11%|█         | 11/100 [00:20<02:34,  1.74s/it] 12%|█▁        | 12/100 [00:22<02:26,  1.66s/it] 13%|█▎        | 13/100 [00:23<02:12,  1.52s/it] 14%|█▁        | 14/100 [00:26<02:47,  1.95s/it] 15%|█▌        | 15/100 [00:27<02:27,  1.73s/it] 16%|█▌        | 16/100 [00:28<02:04,  1.49s/it] 17%|█▋        | 17/100 [00:29<01:52,  1.35s/it] 18%|█▊        | 18/100 [00:30<01:44,  1.27s/it] {'loss': 2.7577, 'grad_norm': 0.6086426377296448, 'learning_rate': 3.4000000000000007e-05, 'epoch': 0.02}
{'loss': 2.4866, 'grad_norm': 0.6495210528373718, 'learning_rate': 5.4000000000000005e-05, 'epoch': 0.03}
19%|█▉        | 19/100 [00:31<01:41,  1.25s/it] 20%|██        | 20/100 [00:34<02:02,  1.53s/it]                                                 20%|██        | 20/100 [00:34<02:02,  1.53s/it] 21%|██        | 21/100 [00:35<02:03,  1.56s/it] 22%|██▁       | 22/100 [00:37<01:58,  1.52s/it] 23%|██▎       | 23/100 [00:38<01:50,  1.43s/it] 24%|██▁       | 24/100 [00:39<01:38,  1.30s/it] 25%|██▌       | 25/100 [00:42<02:11,  1.76s/it] 26%|██▌       | 26/100 [00:43<02:05,  1.69s/it] 27%|██▋       | 27/100 [00:44<01:50,  1.51s/it] 28%|██▊       | 28/100 [00:46<01:42,  1.43s/it] 29%|██▉       | 29/100 [00:47<01:38,  1.38s/it] 30%|███       | 30/100 [00:48<01:32,  1.32s/it]                                                 30%|███       | 30/100 [00:48<01:32,  1.32s/it] 31%|███       | 31/100 [00:49<01:24,  1.23s/it] 32%|███▁      | 32/100 [00:50<01:18,  1.15s/it] 33%|███▎      | 33/100 [00:52<01:27,  1.31{'loss': 1.9249, 'grad_norm': 0.6027202606201172, 'learning_rate': 7.4e-05, 'epoch': 0.05}
s/it] 34%|███▁      | 34/100 [00:53<01:25,  1.30s/it] 35%|███▌      | 35/100 [00:54<01:19,  1.23s/it] 36%|███▌      | 36/100 [00:57<01:51,  1.74s/it] 37%|███▋      | 37/100 [00:58<01:41,  1.61s/it] 38%|███▊      | 38/100 [00:59<01:31,  1.48s/it] 39%|███▉      | 39/100 [01:00<01:20,  1.32s/it] 40%|████      | 40/100 [01:03<01:37,  1.62s/it]                                                 40%|████      | 40/100 [01:03<01:37,  1.62s/it] 41%|████      | 41/100 [01:04<01:29,  1.52s/it] 42%|████▁     | 42/100 [01:05<01:26,  1.49s/it] 43%|████▎     | 43/100 [01:06<01:17,  1.35s/it] 44%|████▁     | 44/100 [01:07<01:09,  1.24s/it] 45%|████▌     | 45/100 [01:09<01:13,  1.33s/it] 46%|████▌     | 46/100 [01:10<01:11,  1.32s/it] 47%|████▋     | 47/100 [01:11<01:08,  1.29s/it] 48%|████▊     | 48/100 [01:12<01:03,  1.23s/it] 49%|████▉     | 49/100 [01:14<0{'loss': 1.2349, 'grad_norm': 0.35607731342315674, 'learning_rate': 9.4e-05, 'epoch': 0.06}
{'loss': 1.0033, 'grad_norm': 0.2938251793384552, 'learning_rate': 0.00011399999999999999, 'epoch': 0.07}
1:10,  1.38s/it] 50%|█████     | 50/100 [01:16<01:13,  1.47s/it]                                                 50%|█████     | 50/100 [01:16<01:13,  1.47s/it] 51%|█████     | 51/100 [01:17<01:07,  1.37s/it] 52%|█████▁    | 52/100 [01:18<01:01,  1.27s/it] 53%|█████▎    | 53/100 [01:19<00:55,  1.17s/it] 54%|█████▁    | 54/100 [01:20<00:52,  1.15s/it] 55%|█████▌    | 55/100 [01:22<01:01,  1.36s/it] 56%|█████▌    | 56/100 [01:23<00:57,  1.30s/it] 57%|█████▋    | 57/100 [01:24<00:55,  1.28s/it] 58%|█████▊    | 58/100 [01:26<00:54,  1.30s/it] 59%|█████▉    | 59/100 [01:28<01:02,  1.51s/it] 60%|██████    | 60/100 [01:29<00:55,  1.39s/it]                                                 60%|██████    | 60/100 [01:29<00:55,  1.39s/it] 61%|██████    | 61/100 [01:30<00:50,  1.28s/it] 62%|██████▁   | 62/100 [01:32<00:58,  1.55s/{'loss': 0.9877, 'grad_norm': 0.2909325063228607, 'learning_rate': 0.000134, 'epoch': 0.08}
it] 63%|██████▎   | 63/100 [01:34<00:59,  1.62s/it] 64%|██████▁   | 64/100 [01:35<00:58,  1.63s/it] 65%|██████▌   | 65/100 [01:37<00:52,  1.51s/it] 66%|██████▌   | 66/100 [01:38<00:48,  1.43s/it] 67%|██████▋   | 67/100 [01:39<00:45,  1.38s/it] 68%|██████▊   | 68/100 [01:40<00:42,  1.33s/it] 69%|██████▉   | 69/100 [01:42<00:40,  1.29s/it] 70%|███████   | 70/100 [01:43<00:37,  1.24s/it]                                                 70%|███████   | 70/100 [01:43<00:37,  1.24s/it] 71%|███████   | 71/100 [01:45<00:45,  1.57s/it] 72%|███████▁  | 72/100 [01:47<00:43,  1.55s/it] 73%|███████▎  | 73/100 [01:48<00:39,  1.46s/it] 74%|███████▁  | 74/100 [01:49<00:38,  1.48s/it] 75%|███████▌  | 75/100 [01:50<00:34,  1.36s/it] 76%|███████▌  | 76/100 [01:52<00:33,  1.38s/it] 77%|███{'loss': 0.9233, 'grad_norm': 0.2819194495677948, 'learning_rate': 0.000154, 'epoch': 0.09}
███▋  | 77/100 [01:54<00:38,  1.66s/it] 78%|███████▊  | 78/100 [01:55<00:34,  1.55s/it] 79%|███████▉  | 79/100 [01:57<00:29,  1.40s/it] 80%|████████  | 80/100 [01:58<00:29,  1.46s/it]                                                 80%|████████  | 80/100 [01:58<00:29,  1.46s/it] 81%|████████  | 81/100 [01:59<00:25,  1.35s/it] 82%|████████▁ | 82/100 [02:01<00:25,  1.40s/it] 83%|████████▎ | 83/100 [02:02<00:22,  1.30s/it] 84%|████████▁ | 84/100 [02:04<00:22,  1.42s/it] 85%|████████▌ | 85/100 [02:05<00:22,  1.49s/it] 86%|████████▌ | 86/100 [02:06<00:19,  1.38s/it] 87%|████████▋ | 87/100 [02:08<00:18,  1.43s/it] 88%|████████▊ | 88/100 [02:09<00:16,  1.36s/it] 89%|████████▉ | 89/100 [02:10<00:14,  1.28s/it] 90%|█████████ | 90/100 [02:11<00:12,  1.22s/{'loss': 0.8996, 'grad_norm': 0.27994975447654724, 'learning_rate': 0.000174, 'epoch': 0.1}
{'loss': 0.8379, 'grad_norm': 0.31300145387649536, 'learning_rate': 0.000194, 'epoch': 0.12}
it]                                                 90%|█████████ | 90/100 [02:11<00:12,  1.22s/it] 91%|█████████ | 91/100 [02:13<00:11,  1.27s/it] 92%|█████████▁| 92/100 [02:14<00:09,  1.19s/it] 93%|█████████▎| 93/100 [02:15<00:09,  1.29s/it] 94%|█████████▁| 94/100 [02:16<00:07,  1.25s/it] 95%|█████████▌| 95/100 [02:17<00:05,  1.17s/it] 96%|█████████▌| 96/100 [02:18<00:04,  1.14s/it] 97%|█████████▋| 97/100 [02:19<00:03,  1.11s/it] 98%|█████████▊| 98/100 [02:22<00:03,  1.65s/it] 99%|█████████▉| 99/100 [02:24<00:01,  1.66s/it]100%|██████████| 100/100 [02:25<00:00,  1.53s/it]                                                 100%|██████████| 100/100 [02:25<00:00,  1.53s/it]

Training completed. Do not forget to share your model on huggingface.co/models =)


{'train_runtime': 159.8429, 'train_samples_per_second': 10.01, 'train_steps_per_second': 0.626, 'train_loss': 1.5783513641357423, 'epoch': 0.12}
                                                 100%|██████████| 100/100 [02:25<00:00,  1.53s/it]100%|██████████| 100/100 [02:25<00:00,  1.46s/it]
LlamaForCausalLM(
  (model): LlamaModel(
    (embed_tokens): Embedding(32016, 4096)
    (layers): ModuleList(
      (0-31): 32 x LlamaDecoderLayer(
        (self_attn): LlamaSdpaAttention(
          (q_proj): lora.Linear8bitLt(
            (base_layer): Linear8bitLt(in_features=4096, out_features=4096, bias=False)
            (lora_dropout): ModuleDict(
              (default): Identity()
            )
            (lora_A): ModuleDict(
              (default): Linear(in_features=4096, out_features=16, bias=False)
            )
            (lora_B): ModuleDict(
              (default): Linear(in_features=16, out_features=4096, bias=False)
            )
            (lora_embedding_A): ParameterDict()
            (lora_embedding_B): ParameterDict()
          )
          (k_proj): lora.Linear8bitLt(
            (base_layer): Linear8bitLt(in_features=4096, out_features=4096, bias=False)
            (lora_dropout): ModuleDict(
              (default): Identity()
            )
            (lora_A): ModuleDict(
              (default): Linear(in_features=4096, out_features=16, bias=False)
            )
            (lora_B): ModuleDict(
              (default): Linear(in_features=16, out_features=4096, bias=False)
            )
            (lora_embedding_A): ParameterDict()
            (lora_embedding_B): ParameterDict()
          )
          (v_proj): lora.Linear8bitLt(
            (base_layer): Linear8bitLt(in_features=4096, out_features=4096, bias=False)
            (lora_dropout): ModuleDict(
              (default): Identity()
            )
            (lora_A): ModuleDict(
              (default): Linear(in_features=4096, out_features=16, bias=False)
            )
            (lora_B): ModuleDict(
              (default): Linear(in_features=16, out_features=4096, bias=False)
            )
            (lora_embedding_A): ParameterDict()
            (lora_embedding_B): ParameterDict()
          )
          (o_proj): lora.Linear8bitLt(
            (base_layer): Linear8bitLt(in_features=4096, out_features=4096, bias=False)
            (lora_dropout): ModuleDict(
              (default): Identity()
            )
            (lora_A): ModuleDict(
              (default): Linear(in_features=4096, out_features=16, bias=False)
            )
            (lora_B): ModuleDict(
              (default): Linear(in_features=16, out_features=4096, bias=False)
            )
            (lora_embedding_A): ParameterDict()
            (lora_embedding_B): ParameterDict()
          )
          (rotary_emb): LlamaRotaryEmbedding()
        )
        (mlp): LlamaMLP(
          (gate_proj): lora.Linear8bitLt(
            (base_layer): Linear8bitLt(in_features=4096, out_features=11008, bias=False)
            (lora_dropout): ModuleDict(
              (default): Identity()
            )
            (lora_A): ModuleDict(
              (default): Linear(in_features=4096, out_features=16, bias=False)
            )
            (lora_B): ModuleDict(
              (default): Linear(in_features=16, out_features=11008, bias=False)
            )
            (lora_embedding_A): ParameterDict()
            (lora_embedding_B): ParameterDict()
          )
          (up_proj): lora.Linear8bitLt(
            (base_layer): Linear8bitLt(in_features=4096, out_features=11008, bias=False)
            (lora_dropout): ModuleDict(
              (default): Identity()
            )
            (lora_A): ModuleDict(
              (default): Linear(in_features=4096, out_features=16, bias=False)
            )
            (lora_B): ModuleDict(
              (default): Linear(in_features=16, out_features=11008, bias=False)
            )
            (lora_embedding_A): ParameterDict()
            (lora_embedding_B): ParameterDict()
          )
          (down_proj): lora.Linear8bitLt(
            (base_layer): Linear8bitLt(in_features=11008, out_features=4096, bias=False)
            (lora_dropout): ModuleDict(
              (default): Identity()
            )
            (lora_A): ModuleDict(
              (default): Linear(in_features=11008, out_features=16, bias=False)
            )
            (lora_B): ModuleDict(
              (default): Linear(in_features=16, out_features=4096, bias=False)
            )
            (lora_embedding_A): ParameterDict()
            (lora_embedding_B): ParameterDict()
          )
          (act_fn): SiLU()
        )
        (input_layernorm): LlamaRMSNorm()
        (post_attention_layernorm): LlamaRMSNorm()
      )
    )
    (norm): LlamaRMSNorm()
  )
  (lm_head): Linear(in_features=4096, out_features=32016, bias=False)
)
Saving the last checkpoint of the model
LlamaForCausalLM(
  (model): LlamaModel(
    (embed_tokens): Embedding(32016, 4096)
    (layers): ModuleList(
      (0-31): 32 x LlamaDecoderLayer(
        (self_attn): LlamaSdpaAttention(
          (q_proj): lora.Linear8bitLt(
            (base_layer): Linear8bitLt(in_features=4096, out_features=4096, bias=False)
            (lora_dropout): ModuleDict(
              (default): Identity()
            )
            (lora_A): ModuleDict(
              (default): Linear(in_features=4096, out_features=16, bias=False)
            )
            (lora_B): ModuleDict(
              (default): Linear(in_features=16, out_features=4096, bias=False)
            )
            (lora_embedding_A): ParameterDict()
            (lora_embedding_B): ParameterDict()
          )
          (k_proj): lora.Linear8bitLt(
            (base_layer): Linear8bitLt(in_features=4096, out_features=4096, bias=False)
            (lora_dropout): ModuleDict(
              (default): Identity()
            )
            (lora_A): ModuleDict(
              (default): Linear(in_features=4096, out_features=16, bias=False)
            )
            (lora_B): ModuleDict(
              (default): Linear(in_features=16, out_features=4096, bias=False)
            )
            (lora_embedding_A): ParameterDict()
            (lora_embedding_B): ParameterDict()
          )
          (v_proj): lora.Linear8bitLt(
            (base_layer): Linear8bitLt(in_features=4096, out_features=4096, bias=False)
            (lora_dropout): ModuleDict(
              (default): Identity()
            )
            (lora_A): ModuleDict(
              (default): Linear(in_features=4096, out_features=16, bias=False)
            )
            (lora_B): ModuleDict(
              (default): Linear(in_features=16, out_features=4096, bias=False)
            )
            (lora_embedding_A): ParameterDict()
            (lora_embedding_B): ParameterDict()
          )
          (o_proj): lora.Linear8bitLt(
            (base_layer): Linear8bitLt(in_features=4096, out_features=4096, bias=False)
            (lora_dropout): ModuleDict(
              (default): Identity()
            )
            (lora_A): ModuleDict(
              (default): Linear(in_features=4096, out_features=16, bias=False)
            )
            (lora_B): ModuleDict(
              (default): Linear(in_features=16, out_features=4096, bias=False)
            )
            (lora_embedding_A): ParameterDict()
            (lora_embedding_B): ParameterDict()
          )
          (rotary_emb): LlamaRotaryEmbedding()
        )
        (mlp): LlamaMLP(
          (gate_proj): lora.Linear8bitLt(
            (base_layer): Linear8bitLt(in_features=4096, out_features=11008, bias=False)
            (lora_dropout): ModuleDict(
              (default): Identity()
            )
            (lora_A): ModuleDict(
              (default): Linear(in_features=4096, out_features=16, bias=False)
            )
            (lora_B): ModuleDict(
              (default): Linear(in_features=16, out_features=11008, bias=False)
            )
            (lora_embedding_A): ParameterDict()
            (lora_embedding_B): ParameterDict()
          )
          (up_proj): lora.Linear8bitLt(
            (base_layer): Linear8bitLt(in_features=4096, out_features=11008, bias=False)
            (lora_dropout): ModuleDict(
              (default): Identity()
            )
            (lora_A): ModuleDict(
              (default): Linear(in_features=4096, out_features=16, bias=False)
            )
            (lora_B): ModuleDict(
              (default): Linear(in_features=16, out_features=11008, bias=False)
            )
            (lora_embedding_A): ParameterDict()
            (lora_embedding_B): ParameterDict()
          )
          (down_proj): lora.Linear8bitLt(
            (base_layer): Linear8bitLt(in_features=11008, out_features=4096, bias=False)
            (lora_dropout): ModuleDict(
              (default): Identity()
            )
            (lora_A): ModuleDict(
              (default): Linear(in_features=11008, out_features=16, bias=False)
            )
            (lora_B): ModuleDict(
              (default): Linear(in_features=16, out_features=4096, bias=False)
            )
            (lora_embedding_A): ParameterDict()
            (lora_embedding_B): ParameterDict()
          )
          (act_fn): SiLU()
        )
        (input_layernorm): LlamaRMSNorm()
        (post_attention_layernorm): LlamaRMSNorm()
      )
    )
    (norm): LlamaRMSNorm()
  )
  (lm_head): Linear(in_features=4096, out_features=32016, bias=False)
)
Saving the last checkpoint of the model
LlamaForCausalLM(
  (model): LlamaModel(
    (embed_tokens): Embedding(32016, 4096)
    (layers): ModuleList(
      (0-31): 32 x LlamaDecoderLayer(
        (self_attn): LlamaSdpaAttention(
          (q_proj): lora.Linear8bitLt(
            (base_layer): Linear8bitLt(in_features=4096, out_features=4096, bias=False)
            (lora_dropout): ModuleDict(
              (default): Identity()
            )
            (lora_A): ModuleDict(
              (default): Linear(in_features=4096, out_features=16, bias=False)
            )
            (lora_B): ModuleDict(
              (default): Linear(in_features=16, out_features=4096, bias=False)
            )
            (lora_embedding_A): ParameterDict()
            (lora_embedding_B): ParameterDict()
          )
          (k_proj): lora.Linear8bitLt(
            (base_layer): Linear8bitLt(in_features=4096, out_features=4096, bias=False)
            (lora_dropout): ModuleDict(
              (default): Identity()
            )
            (lora_A): ModuleDict(
              (default): Linear(in_features=4096, out_features=16, bias=False)
            )
            (lora_B): ModuleDict(
              (default): Linear(in_features=16, out_features=4096, bias=False)
            )
            (lora_embedding_A): ParameterDict()
            (lora_embedding_B): ParameterDict()
          )
          (v_proj): lora.Linear8bitLt(
            (base_layer): Linear8bitLt(in_features=4096, out_features=4096, bias=False)
            (lora_dropout): ModuleDict(
              (default): Identity()
            )
            (lora_A): ModuleDict(
              (default): Linear(in_features=4096, out_features=16, bias=False)
            )
            (lora_B): ModuleDict(
              (default): Linear(in_features=16, out_features=4096, bias=False)
            )
            (lora_embedding_A): ParameterDict()
            (lora_embedding_B): ParameterDict()
          )
          (o_proj): lora.Linear8bitLt(
            (base_layer): Linear8bitLt(in_features=4096, out_features=4096, bias=False)
            (lora_dropout): ModuleDict(
              (default): Identity()
            )
            (lora_A): ModuleDict(
              (default): Linear(in_features=4096, out_features=16, bias=False)
            )
            (lora_B): ModuleDict(
              (default): Linear(in_features=16, out_features=4096, bias=False)
            )
            (lora_embedding_A): ParameterDict()
            (lora_embedding_B): ParameterDict()
          )
          (rotary_emb): LlamaRotaryEmbedding()
        )
        (mlp): LlamaMLP(
          (gate_proj): lora.Linear8bitLt(
            (base_layer): Linear8bitLt(in_features=4096, out_features=11008, bias=False)
            (lora_dropout): ModuleDict(
              (default): Identity()
            )
            (lora_A): ModuleDict(
              (default): Linear(in_features=4096, out_features=16, bias=False)
            )
            (lora_B): ModuleDict(
              (default): Linear(in_features=16, out_features=11008, bias=False)
            )
            (lora_embedding_A): ParameterDict()
            (lora_embedding_B): ParameterDict()
          )
          (up_proj): lora.Linear8bitLt(
            (base_layer): Linear8bitLt(in_features=4096, out_features=11008, bias=False)
            (lora_dropout): ModuleDict(
              (default): Identity()
            )
            (lora_A): ModuleDict(
              (default): Linear(in_features=4096, out_features=16, bias=False)
            )
            (lora_B): ModuleDict(
              (default): Linear(in_features=16, out_features=11008, bias=False)
            )
            (lora_embedding_A): ParameterDict()
            (lora_embedding_B): ParameterDict()
          )
          (down_proj): lora.Linear8bitLt(
            (base_layer): Linear8bitLt(in_features=11008, out_features=4096, bias=False)
            (lora_dropout): ModuleDict(
              (default): Identity()
            )
            (lora_A): ModuleDict(
              (default): Linear(in_features=11008, out_features=16, bias=False)
            )
            (lora_B): ModuleDict(
              (default): Linear(in_features=16, out_features=4096, bias=False)
            )
            (lora_embedding_A): ParameterDict()
            (lora_embedding_B): ParameterDict()
          )
          (act_fn): SiLU()
        )
        (input_layernorm): LlamaRMSNorm()
        (post_attention_layernorm): LlamaRMSNorm()
      )
    )
    (norm): LlamaRMSNorm()
  )
  (lm_head): Linear(in_features=4096, out_features=32016, bias=False)
)
Saving the last checkpoint of the model
LlamaForCausalLM(
  (model): LlamaModel(
    (embed_tokens): Embedding(32016, 4096)
    (layers): ModuleList(
      (0-31): 32 x LlamaDecoderLayer(
        (self_attn): LlamaSdpaAttention(
          (q_proj): lora.Linear8bitLt(
            (base_layer): Linear8bitLt(in_features=4096, out_features=4096, bias=False)
            (lora_dropout): ModuleDict(
              (default): Identity()
            )
            (lora_A): ModuleDict(
              (default): Linear(in_features=4096, out_features=16, bias=False)
            )
            (lora_B): ModuleDict(
              (default): Linear(in_features=16, out_features=4096, bias=False)
            )
            (lora_embedding_A): ParameterDict()
            (lora_embedding_B): ParameterDict()
          )
          (k_proj): lora.Linear8bitLt(
            (base_layer): Linear8bitLt(in_features=4096, out_features=4096, bias=False)
            (lora_dropout): ModuleDict(
              (default): Identity()
            )
            (lora_A): ModuleDict(
              (default): Linear(in_features=4096, out_features=16, bias=False)
            )
            (lora_B): ModuleDict(
              (default): Linear(in_features=16, out_features=4096, bias=False)
            )
            (lora_embedding_A): ParameterDict()
            (lora_embedding_B): ParameterDict()
          )
          (v_proj): lora.Linear8bitLt(
            (base_layer): Linear8bitLt(in_features=4096, out_features=4096, bias=False)
            (lora_dropout): ModuleDict(
              (default): Identity()
            )
            (lora_A): ModuleDict(
              (default): Linear(in_features=4096, out_features=16, bias=False)
            )
            (lora_B): ModuleDict(
              (default): Linear(in_features=16, out_features=4096, bias=False)
            )
            (lora_embedding_A): ParameterDict()
            (lora_embedding_B): ParameterDict()
          )
          (o_proj): lora.Linear8bitLt(
            (base_layer): Linear8bitLt(in_features=4096, out_features=4096, bias=False)
            (lora_dropout): ModuleDict(
              (default): Identity()
            )
            (lora_A): ModuleDict(
              (default): Linear(in_features=4096, out_features=16, bias=False)
            )
            (lora_B): ModuleDict(
              (default): Linear(in_features=16, out_features=4096, bias=False)
            )
            (lora_embedding_A): ParameterDict()
            (lora_embedding_B): ParameterDict()
          )
          (rotary_emb): LlamaRotaryEmbedding()
        )
        (mlp): LlamaMLP(
          (gate_proj): lora.Linear8bitLt(
            (base_layer): Linear8bitLt(in_features=4096, out_features=11008, bias=False)
            (lora_dropout): ModuleDict(
              (default): Identity()
            )
            (lora_A): ModuleDict(
              (default): Linear(in_features=4096, out_features=16, bias=False)
            )
            (lora_B): ModuleDict(
              (default): Linear(in_features=16, out_features=11008, bias=False)
            )
            (lora_embedding_A): ParameterDict()
            (lora_embedding_B): ParameterDict()
          )
          (up_proj): lora.Linear8bitLt(
            (base_layer): Linear8bitLt(in_features=4096, out_features=11008, bias=False)
            (lora_dropout): ModuleDict(
              (default): Identity()
            )
            (lora_A): ModuleDict(
              (default): Linear(in_features=4096, out_features=16, bias=False)
            )
            (lora_B): ModuleDict(
              (default): Linear(in_features=16, out_features=11008, bias=False)
            )
            (lora_embedding_A): ParameterDict()
            (lora_embedding_B): ParameterDict()
          )
          (down_proj): lora.Linear8bitLt(
            (base_layer): Linear8bitLt(in_features=11008, out_features=4096, bias=False)
            (lora_dropout): ModuleDict(
              (default): Identity()
            )
            (lora_A): ModuleDict(
              (default): Linear(in_features=11008, out_features=16, bias=False)
            )
            (lora_B): ModuleDict(
              (default): Linear(in_features=16, out_features=4096, bias=False)
            )
            (lora_embedding_A): ParameterDict()
            (lora_embedding_B): ParameterDict()
          )
          (act_fn): SiLU()
        )
        (input_layernorm): LlamaRMSNorm()
        (post_attention_layernorm): LlamaRMSNorm()
      )
    )
    (norm): LlamaRMSNorm()
  )
  (lm_head): Linear(in_features=4096, out_features=32016, bias=False)
)
Saving the last checkpoint of the model
Training Done! 💥
Training Done! 💥
Training Done! 💥
Training Done! 💥
Configuration saved in //scratch/bbvz/choprahetarth/starcoder2_script/codellama-7b-hf/final_checkpoint/config.json
Configuration saved in //scratch/bbvz/choprahetarth/starcoder2_script/codellama-7b-hf/final_checkpoint/generation_config.json
The model is bigger than the maximum size per checkpoint (5GB) and is going to be split in 2 checkpoint shards. You can find where each parameters has been saved in the index located at //scratch/bbvz/choprahetarth/starcoder2_script/codellama-7b-hf/final_checkpoint/model.safetensors.index.json.
wandb: - 0.008 MB of 0.008 MB uploadedwandb: \ 0.008 MB of 0.008 MB uploadedwandb: | 0.008 MB of 0.008 MB uploadedwandb: / 0.036 MB of 0.058 MB uploadedwandb: 
wandb: Run history:
wandb:         train/epoch ▁▂▃▃▄▅▆▆▇██
wandb:   train/global_step ▁▂▃▃▄▅▆▆▇██
wandb:     train/grad_norm ▂▇█▇▂▁▁▁▁▂
wandb: train/learning_rate ▁▂▂▃▄▅▆▆▇█
wandb:          train/loss ██▇▅▂▂▂▁▁▁
wandb: 
wandb: Run summary:
wandb:               total_flos 8724295463206912.0
wandb:              train/epoch 0.11655
wandb:        train/global_step 100
wandb:          train/grad_norm 0.313
wandb:      train/learning_rate 0.00019
wandb:               train/loss 0.8379
wandb:               train_loss 1.57835
wandb:            train_runtime 159.8429
wandb: train_samples_per_second 10.01
wandb:   train_steps_per_second 0.626
wandb: 
wandb: 🚀 View run train-CodeLlama-7b-hf at: https://wandb.ai/hetarthvader/huggingface/runs/bm44clz9
wandb: ⭐️ View project at: https://wandb.ai/hetarthvader/huggingface
wandb: Synced 6 W&B file(s), 0 media file(s), 2 artifact file(s) and 0 other file(s)
wandb: Find logs at: /scratch/bbvz/choprahetarth/wandb/run-20240622_181751-bm44clz9/logs
wandb: WARNING The new W&B backend becomes opt-out in version 0.18.0; try it out with `wandb.require("core")`! See https://wandb.me/wandb-core for more information.
