Running "module reset". Resetting modules to system default. The following $MODULEPATH directories have been removed: None
WARNING:__main__:
*****************************************
Setting OMP_NUM_THREADS environment variable for each process to be 1 in default, to avoid your system being overloaded, please further tune the variable for optimal performance in your application as needed. 
*****************************************
/u/choprahetarth/all_files/starcoder2
/u/choprahetarth/all_files/starcoder2
/u/choprahetarth/all_files/starcoder2
/u/choprahetarth/all_files/starcoder2
I am loading LORA
Loading BNB
Loading Model
I am loading LORA
Loading BNB
Loading Model
I am loading LORA
Loading BNB
Loading Model
I am loading LORA
Loading BNB
Loading Model

Downloading shards:   0%|          | 0/2 [00:00<?, ?it/s]
Downloading shards:   0%|          | 0/2 [00:00<?, ?it/s]
Downloading shards:   0%|          | 0/2 [00:00<?, ?it/s]
Downloading shards:   0%|          | 0/2 [00:00<?, ?it/s]
Downloading shards:  50%|█████     | 1/2 [03:36<03:36, 216.05s/it]
Downloading shards:  50%|█████     | 1/2 [03:35<03:35, 215.99s/it]
Downloading shards:  50%|█████     | 1/2 [03:36<03:36, 216.02s/it]
Downloading shards:  50%|█████     | 1/2 [03:36<03:36, 216.02s/it]
Downloading shards: 100%|██████████| 2/2 [04:01<00:00, 104.04s/it]
Downloading shards: 100%|██████████| 2/2 [04:01<00:00, 120.84s/it]

Downloading shards: 100%|██████████| 2/2 [04:01<00:00, 104.03s/it]
Downloading shards: 100%|██████████| 2/2 [04:01<00:00, 120.83s/it]

Downloading shards: 100%|██████████| 2/2 [04:01<00:00, 104.01s/it]
Downloading shards: 100%|██████████| 2/2 [04:01<00:00, 120.81s/it]

Downloading shards: 100%|██████████| 2/2 [04:01<00:00, 104.08s/it]
Downloading shards: 100%|██████████| 2/2 [04:01<00:00, 120.86s/it]

Loading checkpoint shards:   0%|          | 0/2 [00:00<?, ?it/s]
Loading checkpoint shards:   0%|          | 0/2 [00:00<?, ?it/s]
Loading checkpoint shards:   0%|          | 0/2 [00:00<?, ?it/s]
Loading checkpoint shards:   0%|          | 0/2 [00:00<?, ?it/s]
Loading checkpoint shards:  50%|█████     | 1/2 [00:06<00:06,  6.57s/it]
Loading checkpoint shards:  50%|█████     | 1/2 [00:07<00:07,  7.35s/it]
Loading checkpoint shards:  50%|█████     | 1/2 [00:07<00:07,  7.42s/it]
Loading checkpoint shards:  50%|█████     | 1/2 [00:07<00:07,  7.47s/it]
Loading checkpoint shards: 100%|██████████| 2/2 [00:07<00:00,  3.27s/it]
Loading checkpoint shards: 100%|██████████| 2/2 [00:07<00:00,  3.76s/it]
Model Loaded
Setting num_proc from 64 back to 1 for the train split to disable multiprocessing as it only contains one shard.

Generating train split: 0 examples [00:00, ? examples/s]
Generating train split: 15246 examples [00:00, 100020.74 examples/s]
Generating train split: 15246 examples [00:00, 99235.49 examples/s] 

Map:   0%|          | 0/15246 [00:00<?, ? examples/s]
Map:  15%|█▁        | 2220/15246 [00:00<00:00, 22072.35 examples/s]
Map:  30%|██▉       | 4573/15246 [00:00<00:00, 22925.40 examples/s]
Loading checkpoint shards: 100%|██████████| 2/2 [00:08<00:00,  3.73s/it]
Loading checkpoint shards: 100%|██████████| 2/2 [00:08<00:00,  4.29s/it]

Loading checkpoint shards: 100%|██████████| 2/2 [00:08<00:00,  3.71s/it]
Loading checkpoint shards: 100%|██████████| 2/2 [00:08<00:00,  4.27s/it]

Loading checkpoint shards: 100%|██████████| 2/2 [00:08<00:00,  3.69s/it]
Loading checkpoint shards: 100%|██████████| 2/2 [00:08<00:00,  4.24s/it]

Map:  45%|████▌     | 6913/15246 [00:00<00:00, 23135.34 examples/s]
Map:  61%|██████    | 9230/15246 [00:00<00:00, 23147.25 examples/s]Model Loaded
Model Loaded
Model Loaded

Map:  76%|███████▌  | 11556/15246 [00:00<00:00, 23182.53 examples/s]
Map:  98%|█████████▊| 15000/15246 [00:00<00:00, 23035.28 examples/s]
Map:   0%|          | 0/15246 [00:00<?, ? examples/s]
Map:   0%|          | 0/15246 [00:00<?, ? examples/s]
Map: 100%|██████████| 15246/15246 [00:00<00:00, 22820.16 examples/s]
Sample from the training dataset:  {'prompt': 'Given this Ansible Name Field, please generate the ansible task. name: Ensure fail2ban service is enabled and started', 'completion': 'service:\n  name: fail2ban\n  state: started\n  enabled: true\nwhen: centos_base_fail2ban_configuration|bool\n'}
Sample from the training dataset:  {'prompt': 'Given this Ansible Name Field, please generate the ansible task. name: Ensure fail2ban service is enabled and started', 'completion': 'service:\n  name: fail2ban\n  state: started\n  enabled: true\nwhen: centos_base_fail2ban_configuration|bool\n'}
/u/choprahetarth/.conda/envs/scoder_2/lib/python3.10/site-packages/huggingface_hub/utils/_deprecation.py:100: FutureWarning: Deprecated argument(s) used in '__init__': max_seq_length. Will not be supported from version '1.0.0'.

Deprecated positional argument(s) used in SFTTrainer, please use the SFTConfig to set these arguments instead.
  warnings.warn(message, FutureWarning)

Map:  14%|█▁        | 2162/15246 [00:00<00:00, 21486.32 examples/s]/u/choprahetarth/.conda/envs/scoder_2/lib/python3.10/site-packages/huggingface_hub/utils/_deprecation.py:100: FutureWarning: Deprecated argument(s) used in '__init__': max_seq_length. Will not be supported from version '1.0.0'.

Deprecated positional argument(s) used in SFTTrainer, please use the SFTConfig to set these arguments instead.
  warnings.warn(message, FutureWarning)

Map:  14%|█▁        | 2154/15246 [00:00<00:00, 21401.74 examples/s]/u/choprahetarth/.conda/envs/scoder_2/lib/python3.10/site-packages/transformers/training_args.py:1965: FutureWarning: `--push_to_hub_token` is deprecated and will be removed in version 5 of 🤗 Transformers. Use `--hub_token` instead.
  warnings.warn(
/u/choprahetarth/.conda/envs/scoder_2/lib/python3.10/site-packages/transformers/training_args.py:1965: FutureWarning: `--push_to_hub_token` is deprecated and will be removed in version 5 of 🤗 Transformers. Use `--hub_token` instead.
  warnings.warn(
/u/choprahetarth/.conda/envs/scoder_2/lib/python3.10/site-packages/transformers/training_args.py:1965: FutureWarning: `--push_to_hub_token` is deprecated and will be removed in version 5 of 🤗 Transformers. Use `--hub_token` instead.
  warnings.warn(

Map:  29%|██▉       | 4497/15246 [00:00<00:00, 22573.62 examples/s]
Map:  29%|██▉       | 4474/15246 [00:00<00:00, 22450.18 examples/s]/u/choprahetarth/.conda/envs/scoder_2/lib/python3.10/site-packages/transformers/training_args.py:1965: FutureWarning: `--push_to_hub_token` is deprecated and will be removed in version 5 of 🤗 Transformers. Use `--hub_token` instead.
  warnings.warn(

Map:  45%|████▁     | 6822/15246 [00:00<00:00, 22877.58 examples/s]
Map:  45%|████▁     | 6790/15246 [00:00<00:00, 22767.11 examples/s]
Map:  60%|█████▉    | 9144/15246 [00:00<00:00, 23010.88 examples/s]
Map:  60%|█████▉    | 9104/15246 [00:00<00:00, 22912.85 examples/s]
Map:  75%|███████▌  | 11478/15246 [00:00<00:00, 23125.93 examples/s]
Map:  75%|███████▁  | 11425/15246 [00:00<00:00, 23015.54 examples/s]
Map:  98%|█████████▊| 14945/15246 [00:00<00:00, 23113.42 examples/s]
Map:  97%|█████████▋| 14857/15246 [00:00<00:00, 22952.26 examples/s]
Map: 100%|██████████| 15246/15246 [00:00<00:00, 22734.83 examples/s]
Sample from the training dataset:  {'prompt': 'Given this Ansible Name Field, please generate the ansible task. name: Ensure fail2ban service is enabled and started', 'completion': 'service:\n  name: fail2ban\n  state: started\n  enabled: true\nwhen: centos_base_fail2ban_configuration|bool\n'}

Map: 100%|██████████| 15246/15246 [00:00<00:00, 22611.16 examples/s]
Sample from the training dataset:  {'prompt': 'Given this Ansible Name Field, please generate the ansible task. name: Ensure fail2ban service is enabled and started', 'completion': 'service:\n  name: fail2ban\n  state: started\n  enabled: true\nwhen: centos_base_fail2ban_configuration|bool\n'}
/u/choprahetarth/.conda/envs/scoder_2/lib/python3.10/site-packages/huggingface_hub/utils/_deprecation.py:100: FutureWarning: Deprecated argument(s) used in '__init__': max_seq_length. Will not be supported from version '1.0.0'.

Deprecated positional argument(s) used in SFTTrainer, please use the SFTConfig to set these arguments instead.
  warnings.warn(message, FutureWarning)
/u/choprahetarth/.conda/envs/scoder_2/lib/python3.10/site-packages/huggingface_hub/utils/_deprecation.py:100: FutureWarning: Deprecated argument(s) used in '__init__': max_seq_length. Will not be supported from version '1.0.0'.

Deprecated positional argument(s) used in SFTTrainer, please use the SFTConfig to set these arguments instead.
  warnings.warn(message, FutureWarning)
/u/choprahetarth/.conda/envs/scoder_2/lib/python3.10/site-packages/transformers/training_args.py:1965: FutureWarning: `--push_to_hub_token` is deprecated and will be removed in version 5 of 🤗 Transformers. Use `--hub_token` instead.
  warnings.warn(
/u/choprahetarth/.conda/envs/scoder_2/lib/python3.10/site-packages/transformers/training_args.py:1965: FutureWarning: `--push_to_hub_token` is deprecated and will be removed in version 5 of 🤗 Transformers. Use `--hub_token` instead.
  warnings.warn(
/u/choprahetarth/.conda/envs/scoder_2/lib/python3.10/site-packages/transformers/training_args.py:1965: FutureWarning: `--push_to_hub_token` is deprecated and will be removed in version 5 of 🤗 Transformers. Use `--hub_token` instead.
  warnings.warn(
/u/choprahetarth/.conda/envs/scoder_2/lib/python3.10/site-packages/transformers/training_args.py:1965: FutureWarning: `--push_to_hub_token` is deprecated and will be removed in version 5 of 🤗 Transformers. Use `--hub_token` instead.
  warnings.warn(
/u/choprahetarth/.conda/envs/scoder_2/lib/python3.10/site-packages/trl/trainer/sft_trainer.py:269: UserWarning: You passed a `max_seq_length` argument to the SFTTrainer, the value you passed will override the one in the `SFTConfig`.
  warnings.warn(
/u/choprahetarth/.conda/envs/scoder_2/lib/python3.10/site-packages/trl/trainer/sft_trainer.py:269: UserWarning: You passed a `max_seq_length` argument to the SFTTrainer, the value you passed will override the one in the `SFTConfig`.
  warnings.warn(
/u/choprahetarth/.conda/envs/scoder_2/lib/python3.10/site-packages/trl/trainer/sft_trainer.py:355: UserWarning: You passed a `dataset_kwargs` argument to the SFTTrainer, the value you passed will override the one in the `SFTConfig`.
  warnings.warn(
/u/choprahetarth/.conda/envs/scoder_2/lib/python3.10/site-packages/trl/trainer/sft_trainer.py:269: UserWarning: You passed a `max_seq_length` argument to the SFTTrainer, the value you passed will override the one in the `SFTConfig`.
  warnings.warn(

Map:   0%|          | 0/13721 [00:00<?, ? examples/s]/u/choprahetarth/.conda/envs/scoder_2/lib/python3.10/site-packages/trl/trainer/sft_trainer.py:269: UserWarning: You passed a `max_seq_length` argument to the SFTTrainer, the value you passed will override the one in the `SFTConfig`.
  warnings.warn(

Map:   7%|▋         | 1000/13721 [00:00<00:01, 7988.82 examples/s]
Map:  22%|██▁       | 3000/13721 [00:00<00:00, 13316.76 examples/s]
Map:  36%|███▋      | 5000/13721 [00:00<00:00, 15441.20 examples/s]
Map:  51%|█████     | 7000/13721 [00:00<00:00, 16402.09 examples/s]
Map:  66%|██████▌   | 9000/13721 [00:00<00:00, 17119.17 examples/s]
Map:  80%|████████  | 11000/13721 [00:00<00:00, 17429.99 examples/s]
Map:  95%|█████████▁| 13000/13721 [00:00<00:00, 17380.10 examples/s]
Map: 100%|██████████| 13721/13721 [00:00<00:00, 16302.01 examples/s]

Map:   0%|          | 0/1525 [00:00<?, ? examples/s]
Map: 100%|██████████| 1525/1525 [00:00<00:00, 13804.50 examples/s]
Map: 100%|██████████| 1525/1525 [00:00<00:00, 13358.44 examples/s]
/u/choprahetarth/.conda/envs/scoder_2/lib/python3.10/site-packages/trl/trainer/sft_trainer.py:355: UserWarning: You passed a `dataset_kwargs` argument to the SFTTrainer, the value you passed will override the one in the `SFTConfig`.
  warnings.warn(
/u/choprahetarth/.conda/envs/scoder_2/lib/python3.10/site-packages/trl/trainer/sft_trainer.py:355: UserWarning: You passed a `dataset_kwargs` argument to the SFTTrainer, the value you passed will override the one in the `SFTConfig`.
  warnings.warn(
/u/choprahetarth/.conda/envs/scoder_2/lib/python3.10/site-packages/trl/trainer/sft_trainer.py:355: UserWarning: You passed a `dataset_kwargs` argument to the SFTTrainer, the value you passed will override the one in the `SFTConfig`.
  warnings.warn(
WARNING:accelerate.utils.other:Detected kernel version 4.18.0, which is below the recommended minimum of 5.5.0; this can cause the process to hang. It is recommended to upgrade the kernel to the minimum version or higher.

Map:   0%|          | 0/1525 [00:00<?, ? examples/s]
Map:   0%|          | 0/1525 [00:00<?, ? examples/s]
Map:   0%|          | 0/1525 [00:00<?, ? examples/s]
Map:  66%|██████▌   | 1000/1525 [00:00<00:00, 7861.72 examples/s]
Map:  66%|██████▌   | 1000/1525 [00:00<00:00, 7386.07 examples/s]
Map:  66%|██████▌   | 1000/1525 [00:00<00:00, 7386.85 examples/s]
Map: 100%|██████████| 1525/1525 [00:00<00:00, 8747.41 examples/s]

Map: 100%|██████████| 1525/1525 [00:00<00:00, 8814.34 examples/s]

Map: 100%|██████████| 1525/1525 [00:00<00:00, 8710.80 examples/s]
Training...
max_steps is given, it will override any value given in num_train_epochs
Training...
max_steps is given, it will override any value given in num_train_epochs
Training...
max_steps is given, it will override any value given in num_train_epochs
Training...
wandb: Currently logged in as: hetarthvader. Use `wandb login --relogin` to force relogin
wandb: wandb version 0.17.4 is available!  To upgrade, please run:
wandb:  $ pip install wandb --upgrade
wandb: Tracking run with wandb version 0.17.2
wandb: Run data is saved locally in /scratch/bbvz/choprahetarth/wandb/run-20240706_171557-9de71616
wandb: Run `wandb offline` to turn off syncing.
wandb: Syncing run train-starcoderbase-3b
wandb: ⭐️ View project at https://wandb.ai/hetarthvader/huggingface
wandb: 🚀 View run at https://wandb.ai/hetarthvader/huggingface/runs/9de71616
[rank2]:[W reducer.cpp:1389] Warning: find_unused_parameters=True was specified in DDP constructor, but did not find any unused parameters in the forward pass. This flag results in an extra traversal of the autograd graph every iteration,  which can adversely affect performance. If your model indeed never has any unused parameters in the forward pass, consider turning this flag off. Note that this warning may be a false positive if your model has flow control causing later iterations to have unused parameters. (function operator())
[rank3]:[W reducer.cpp:1389] Warning: find_unused_parameters=True was specified in DDP constructor, but did not find any unused parameters in the forward pass. This flag results in an extra traversal of the autograd graph every iteration,  which can adversely affect performance. If your model indeed never has any unused parameters in the forward pass, consider turning this flag off. Note that this warning may be a false positive if your model has flow control causing later iterations to have unused parameters. (function operator())
[rank0]:[W reducer.cpp:1389] Warning: find_unused_parameters=True was specified in DDP constructor, but did not find any unused parameters in the forward pass. This flag results in an extra traversal of the autograd graph every iteration,  which can adversely affect performance. If your model indeed never has any unused parameters in the forward pass, consider turning this flag off. Note that this warning may be a false positive if your model has flow control causing later iterations to have unused parameters. (function operator())
[rank1]:[W reducer.cpp:1389] Warning: find_unused_parameters=True was specified in DDP constructor, but did not find any unused parameters in the forward pass. This flag results in an extra traversal of the autograd graph every iteration,  which can adversely affect performance. If your model indeed never has any unused parameters in the forward pass, consider turning this flag off. Note that this warning may be a false positive if your model has flow control causing later iterations to have unused parameters. (function operator())
{'loss': 3.2028, 'grad_norm': 0.3064754903316498, 'learning_rate': 4e-05, 'epoch': 0.046620046620046623}
{'loss': 2.7239, 'grad_norm': 0.5749436616897583, 'learning_rate': 8e-05, 'epoch': 0.09324009324009325}
{'loss': 1.5899, 'grad_norm': 0.347179651260376, 'learning_rate': 0.00012, 'epoch': 0.13986013986013987}
{'loss': 1.2199, 'grad_norm': 0.2656920850276947, 'learning_rate': 0.00016, 'epoch': 0.1864801864801865}
{'loss': 1.1505, 'grad_norm': 0.2795606255531311, 'learning_rate': 0.0002, 'epoch': 0.2331002331002331}
{'loss': 1.0961, 'grad_norm': 0.26252928376197815, 'learning_rate': 0.00019817083199968552, 'epoch': 0.27972027972027974}
{'loss': 1.0821, 'grad_norm': 0.26348474621772766, 'learning_rate': 0.0001927502451102095, 'epoch': 0.32634032634032634}
{'loss': 1.0939, 'grad_norm': 0.33147624135017395, 'learning_rate': 0.000183936542613195, 'epoch': 0.372960372960373}
{'loss': 1.0376, 'grad_norm': 0.2954649329185486, 'learning_rate': 0.0001720521593600787, 'epoch': 0.4195804195804196}
{'loss': 1.0179, 'grad_norm': 0.25434425473213196, 'learning_rate': 0.00015753186602186209, 'epoch': 0.4662004662004662}
{'loss': 1.0007, 'grad_norm': 0.33626341819763184, 'learning_rate': 0.00014090686371713402, 'epoch': 0.5128205128205128}
{'loss': 1.0061, 'grad_norm': 0.29410475492477417, 'learning_rate': 0.00012278535089031378, 'epoch': 0.5594405594405595}
{'loss': 1.0146, 'grad_norm': 0.2676577568054199, 'learning_rate': 0.00010383027336900355, 'epoch': 0.6060606060606061}
{'loss': 0.9933, 'grad_norm': 0.30648064613342285, 'learning_rate': 8.473507157811254e-05, 'epoch': 0.6526806526806527}
{'loss': 1.0168, 'grad_norm': 0.32151326537132263, 'learning_rate': 6.619831215914974e-05, 'epoch': 0.6993006993006993}
{'loss': 0.9799, 'grad_norm': 0.2987891733646393, 'learning_rate': 4.889813205528895e-05, 'epoch': 0.745920745920746}
{'loss': 0.9764, 'grad_norm': 0.2996763586997986, 'learning_rate': 3.346742998344348e-05, 'epoch': 0.7925407925407926}
{'loss': 0.949, 'grad_norm': 0.3397296667098999, 'learning_rate': 2.047071287265735e-05, 'epoch': 0.8391608391608392}
{'loss': 0.9907, 'grad_norm': 0.3476760685443878, 'learning_rate': 1.0383444303894452e-05, 'epoch': 0.8857808857808858}
{'loss': 0.9807, 'grad_norm': 0.30341553688049316, 'learning_rate': 3.5746504546859018e-06, 'epoch': 0.9324009324009324}
{'loss': 0.9883, 'grad_norm': 0.3017488121986389, 'learning_rate': 2.934198816259559e-07, 'epoch': 0.9790209790209791}
{'train_runtime': 395.4864, 'train_samples_per_second': 34.631, 'train_steps_per_second': 1.082, 'train_loss': 1.237028910734943, 'epoch': 0.9976689976689976}
GPTBigCodeForCausalLM(
  (transformer): GPTBigCodeModel(
    (wte): Embedding(49152, 2816)
    (wpe): Embedding(8192, 2816)
    (drop): Dropout(p=0.1, inplace=False)
    (h): ModuleList(
      (0-35): 36 x GPTBigCodeBlock(
        (ln_1): LayerNorm((2816,), eps=1e-05, elementwise_affine=True)
        (attn): GPTBigCodeSdpaAttention(
          (c_attn): lora.Linear4bit(
            (base_layer): Linear4bit(in_features=2816, out_features=3072, bias=True)
            (lora_dropout): ModuleDict(
              (default): Identity()
            )
            (lora_A): ModuleDict(
              (default): Linear(in_features=2816, out_features=16, bias=False)
            )
            (lora_B): ModuleDict(
              (default): Linear(in_features=16, out_features=3072, bias=False)
            )
            (lora_embedding_A): ParameterDict()
            (lora_embedding_B): ParameterDict()
          )
          (c_proj): lora.Linear4bit(
            (base_layer): Linear4bit(in_features=2816, out_features=2816, bias=True)
            (lora_dropout): ModuleDict(
              (default): Identity()
            )
            (lora_A): ModuleDict(
              (default): Linear(in_features=2816, out_features=16, bias=False)
            )
            (lora_B): ModuleDict(
              (default): Linear(in_features=16, out_features=2816, bias=False)
            )
            (lora_embedding_A): ParameterDict()
            (lora_embedding_B): ParameterDict()
          )
          (attn_dropout): Dropout(p=0.1, inplace=False)
          (resid_dropout): Dropout(p=0.1, inplace=False)
        )
        (ln_2): LayerNorm((2816,), eps=1e-05, elementwise_affine=True)
        (mlp): GPTBigCodeMLP(
          (c_fc): Linear4bit(in_features=2816, out_features=11264, bias=True)
          (c_proj): lora.Linear4bit(
            (base_layer): Linear4bit(in_features=11264, out_features=2816, bias=True)
            (lora_dropout): ModuleDict(
              (default): Identity()
            )
            (lora_A): ModuleDict(
              (default): Linear(in_features=11264, out_features=16, bias=False)
            )
            (lora_B): ModuleDict(
              (default): Linear(in_features=16, out_features=2816, bias=False)
            )
            (lora_embedding_A): ParameterDict()
            (lora_embedding_B): ParameterDict()
          )
          (act): PytorchGELUTanh()
          (dropout): Dropout(p=0.1, inplace=False)
        )
      )
    )
    (ln_f): LayerNorm((2816,), eps=1e-05, elementwise_affine=True)
  )
  (lm_head): Linear(in_features=2816, out_features=49152, bias=False)
)
Saving the last checkpoint of the model
saving the model peft layer
GPTBigCodeForCausalLM(
  (transformer): GPTBigCodeModel(
    (wte): Embedding(49152, 2816)
    (wpe): Embedding(8192, 2816)
    (drop): Dropout(p=0.1, inplace=False)
    (h): ModuleList(
      (0-35): 36 x GPTBigCodeBlock(
        (ln_1): LayerNorm((2816,), eps=1e-05, elementwise_affine=True)
        (attn): GPTBigCodeSdpaAttention(
          (c_attn): lora.Linear4bit(
            (base_layer): Linear4bit(in_features=2816, out_features=3072, bias=True)
            (lora_dropout): ModuleDict(
              (default): Identity()
            )
            (lora_A): ModuleDict(
              (default): Linear(in_features=2816, out_features=16, bias=False)
            )
            (lora_B): ModuleDict(
              (default): Linear(in_features=16, out_features=3072, bias=False)
            )
            (lora_embedding_A): ParameterDict()
            (lora_embedding_B): ParameterDict()
          )
          (c_proj): lora.Linear4bit(
            (base_layer): Linear4bit(in_features=2816, out_features=2816, bias=True)
            (lora_dropout): ModuleDict(
              (default): Identity()
            )
            (lora_A): ModuleDict(
              (default): Linear(in_features=2816, out_features=16, bias=False)
            )
            (lora_B): ModuleDict(
              (default): Linear(in_features=16, out_features=2816, bias=False)
            )
            (lora_embedding_A): ParameterDict()
            (lora_embedding_B): ParameterDict()
          )
          (attn_dropout): Dropout(p=0.1, inplace=False)
          (resid_dropout): Dropout(p=0.1, inplace=False)
        )
        (ln_2): LayerNorm((2816,), eps=1e-05, elementwise_affine=True)
        (mlp): GPTBigCodeMLP(
          (c_fc): Linear4bit(in_features=2816, out_features=11264, bias=True)
          (c_proj): lora.Linear4bit(
            (base_layer): Linear4bit(in_features=11264, out_features=2816, bias=True)
            (lora_dropout): ModuleDict(
              (default): Identity()
            )
            (lora_A): ModuleDict(
              (default): Linear(in_features=11264, out_features=16, bias=False)
            )
            (lora_B): ModuleDict(
              (default): Linear(in_features=16, out_features=2816, bias=False)
            )
            (lora_embedding_A): ParameterDict()
            (lora_embedding_B): ParameterDict()
          )
          (act): PytorchGELUTanh()
          (dropout): Dropout(p=0.1, inplace=False)
        )
      )
    )
    (ln_f): LayerNorm((2816,), eps=1e-05, elementwise_affine=True)
  )
  (lm_head): Linear(in_features=2816, out_features=49152, bias=False)
)
Saving the last checkpoint of the model
saving the model peft layer
GPTBigCodeForCausalLM(
  (transformer): GPTBigCodeModel(
    (wte): Embedding(49152, 2816)
    (wpe): Embedding(8192, 2816)
    (drop): Dropout(p=0.1, inplace=False)
    (h): ModuleList(
      (0-35): 36 x GPTBigCodeBlock(
        (ln_1): LayerNorm((2816,), eps=1e-05, elementwise_affine=True)
        (attn): GPTBigCodeSdpaAttention(
          (c_attn): lora.Linear4bit(
            (base_layer): Linear4bit(in_features=2816, out_features=3072, bias=True)
            (lora_dropout): ModuleDict(
              (default): Identity()
            )
            (lora_A): ModuleDict(
              (default): Linear(in_features=2816, out_features=16, bias=False)
            )
            (lora_B): ModuleDict(
              (default): Linear(in_features=16, out_features=3072, bias=False)
            )
            (lora_embedding_A): ParameterDict()
            (lora_embedding_B): ParameterDict()
          )
          (c_proj): lora.Linear4bit(
            (base_layer): Linear4bit(in_features=2816, out_features=2816, bias=True)
            (lora_dropout): ModuleDict(
              (default): Identity()
            )
            (lora_A): ModuleDict(
              (default): Linear(in_features=2816, out_features=16, bias=False)
            )
            (lora_B): ModuleDict(
              (default): Linear(in_features=16, out_features=2816, bias=False)
            )
            (lora_embedding_A): ParameterDict()
            (lora_embedding_B): ParameterDict()
          )
          (attn_dropout): Dropout(p=0.1, inplace=False)
          (resid_dropout): Dropout(p=0.1, inplace=False)
        )
        (ln_2): LayerNorm((2816,), eps=1e-05, elementwise_affine=True)
        (mlp): GPTBigCodeMLP(
          (c_fc): Linear4bit(in_features=2816, out_features=11264, bias=True)
          (c_proj): lora.Linear4bit(
            (base_layer): Linear4bit(in_features=11264, out_features=2816, bias=True)
            (lora_dropout): ModuleDict(
              (default): Identity()
            )
            (lora_A): ModuleDict(
              (default): Linear(in_features=11264, out_features=16, bias=False)
            )
            (lora_B): ModuleDict(
              (default): Linear(in_features=16, out_features=2816, bias=False)
            )
            (lora_embedding_A): ParameterDict()
            (lora_embedding_B): ParameterDict()
          )
          (act): PytorchGELUTanh()
          (dropout): Dropout(p=0.1, inplace=False)
        )
      )
    )
    (ln_f): LayerNorm((2816,), eps=1e-05, elementwise_affine=True)
  )
  (lm_head): Linear(in_features=2816, out_features=49152, bias=False)
)
Saving the last checkpoint of the model
saving the model peft layer
GPTBigCodeForCausalLM(
  (transformer): GPTBigCodeModel(
    (wte): Embedding(49152, 2816)
    (wpe): Embedding(8192, 2816)
    (drop): Dropout(p=0.1, inplace=False)
    (h): ModuleList(
      (0-35): 36 x GPTBigCodeBlock(
        (ln_1): LayerNorm((2816,), eps=1e-05, elementwise_affine=True)
        (attn): GPTBigCodeSdpaAttention(
          (c_attn): lora.Linear4bit(
            (base_layer): Linear4bit(in_features=2816, out_features=3072, bias=True)
            (lora_dropout): ModuleDict(
              (default): Identity()
            )
            (lora_A): ModuleDict(
              (default): Linear(in_features=2816, out_features=16, bias=False)
            )
            (lora_B): ModuleDict(
              (default): Linear(in_features=16, out_features=3072, bias=False)
            )
            (lora_embedding_A): ParameterDict()
            (lora_embedding_B): ParameterDict()
          )
          (c_proj): lora.Linear4bit(
            (base_layer): Linear4bit(in_features=2816, out_features=2816, bias=True)
            (lora_dropout): ModuleDict(
              (default): Identity()
            )
            (lora_A): ModuleDict(
              (default): Linear(in_features=2816, out_features=16, bias=False)
            )
            (lora_B): ModuleDict(
              (default): Linear(in_features=16, out_features=2816, bias=False)
            )
            (lora_embedding_A): ParameterDict()
            (lora_embedding_B): ParameterDict()
          )
          (attn_dropout): Dropout(p=0.1, inplace=False)
          (resid_dropout): Dropout(p=0.1, inplace=False)
        )
        (ln_2): LayerNorm((2816,), eps=1e-05, elementwise_affine=True)
        (mlp): GPTBigCodeMLP(
          (c_fc): Linear4bit(in_features=2816, out_features=11264, bias=True)
          (c_proj): lora.Linear4bit(
            (base_layer): Linear4bit(in_features=11264, out_features=2816, bias=True)
            (lora_dropout): ModuleDict(
              (default): Identity()
            )
            (lora_A): ModuleDict(
              (default): Linear(in_features=11264, out_features=16, bias=False)
            )
            (lora_B): ModuleDict(
              (default): Linear(in_features=16, out_features=2816, bias=False)
            )
            (lora_embedding_A): ParameterDict()
            (lora_embedding_B): ParameterDict()
          )
          (act): PytorchGELUTanh()
          (dropout): Dropout(p=0.1, inplace=False)
        )
      )
    )
    (ln_f): LayerNorm((2816,), eps=1e-05, elementwise_affine=True)
  )
  (lm_head): Linear(in_features=2816, out_features=49152, bias=False)
)
Saving the last checkpoint of the model
saving the model peft layer
/u/choprahetarth/.conda/envs/scoder_2/lib/python3.10/site-packages/huggingface_hub/file_download.py:1132: FutureWarning: `resume_download` is deprecated and will be removed in version 1.0.0. Downloads always resume when possible. If you want to force a new download, use `force_download=True`.
  warnings.warn(
/u/choprahetarth/.conda/envs/scoder_2/lib/python3.10/site-packages/huggingface_hub/file_download.py:1132: FutureWarning: `resume_download` is deprecated and will be removed in version 1.0.0. Downloads always resume when possible. If you want to force a new download, use `force_download=True`.
  warnings.warn(
/u/choprahetarth/.conda/envs/scoder_2/lib/python3.10/site-packages/huggingface_hub/file_download.py:1132: FutureWarning: `resume_download` is deprecated and will be removed in version 1.0.0. Downloads always resume when possible. If you want to force a new download, use `force_download=True`.
  warnings.warn(
/u/choprahetarth/.conda/envs/scoder_2/lib/python3.10/site-packages/huggingface_hub/file_download.py:1132: FutureWarning: `resume_download` is deprecated and will be removed in version 1.0.0. Downloads always resume when possible. If you want to force a new download, use `force_download=True`.
  warnings.warn(
Deleted all GPU Memory
Merging the Lora layers back
Deleted all GPU Memory
Merging the Lora layers back
Deleted all GPU Memory
Merging the Lora layers back
Deleted all GPU Memory
Merging the Lora layers back

Loading checkpoint shards:   0%|          | 0/2 [00:00<?, ?it/s]
Loading checkpoint shards:   0%|          | 0/2 [00:00<?, ?it/s]
Loading checkpoint shards:   0%|          | 0/2 [00:00<?, ?it/s]
Loading checkpoint shards:   0%|          | 0/2 [00:00<?, ?it/s]
Loading checkpoint shards:  50%|█████     | 1/2 [00:06<00:06,  6.32s/it]
Loading checkpoint shards:  50%|█████     | 1/2 [00:06<00:06,  6.33s/it]
Loading checkpoint shards:  50%|█████     | 1/2 [00:06<00:06,  6.39s/it]
Loading checkpoint shards:  50%|█████     | 1/2 [00:06<00:06,  6.43s/it]
Loading checkpoint shards: 100%|██████████| 2/2 [00:07<00:00,  3.35s/it]
Loading checkpoint shards: 100%|██████████| 2/2 [00:07<00:00,  3.80s/it]

Loading checkpoint shards: 100%|██████████| 2/2 [00:07<00:00,  3.37s/it]
Loading checkpoint shards: 100%|██████████| 2/2 [00:07<00:00,  3.81s/it]
Loading PEFT model...

Loading checkpoint shards: 100%|██████████| 2/2 [00:07<00:00,  3.38s/it]
Loading checkpoint shards: 100%|██████████| 2/2 [00:07<00:00,  3.83s/it]

Loading checkpoint shards: 100%|██████████| 2/2 [00:07<00:00,  3.41s/it]
Loading checkpoint shards: 100%|██████████| 2/2 [00:07<00:00,  3.87s/it]
Loading PEFT model...
Loading PEFT model...
Loading PEFT model...
Merging and unloading model...
Merging and unloading model...
Loading tokenizer...
Merging and unloading model...
Loading tokenizer...
Merging and unloading model...
Loading tokenizer...
Saving pretrained model and tokenizer...
Loading tokenizer...
Saving pretrained model and tokenizer...
Saving pretrained model and tokenizer...
Saving pretrained model and tokenizer...
Training Done! 💥
Training Done! 💥
Training Done! 💥
Training Done! 💥
wandb: - 0.008 MB of 0.008 MB uploaded
wandb: \ 0.008 MB of 0.035 MB uploaded
wandb: | 0.035 MB of 0.035 MB uploaded
wandb: 
wandb: Run history:
wandb:         train/epoch ▁▁▂▂▂▃▃▃▄▄▄▅▅▅▆▆▆▇▇███
wandb:   train/global_step ▁▁▂▂▂▃▃▃▄▄▄▅▅▅▆▆▆▇▇███
wandb:     train/grad_norm ▂█▃▁▂▁▁▃▂▁▃▂▁▂▂▂▂▃▃▂▂
wandb: train/learning_rate ▂▄▅▇███▇▇▇▆▅▅▄▃▃▂▂▁▁▁
wandb:          train/loss █▇▃▂▂▁▁▁▁▁▁▁▁▁▁▁▁▁▁▁▁
wandb: 
wandb: Run summary:
wandb:               total_flos 2.1966902561603584e+16
wandb:              train/epoch 0.99767
wandb:        train/global_step 428
wandb:          train/grad_norm 0.30175
wandb:      train/learning_rate 0.0
wandb:               train/loss 0.9883
wandb:               train_loss 1.23703
wandb:            train_runtime 395.4864
wandb: train_samples_per_second 34.631
wandb:   train_steps_per_second 1.082
wandb: 
wandb: 🚀 View run train-starcoderbase-3b at: https://wandb.ai/hetarthvader/huggingface/runs/9de71616
wandb: ⭐️ View project at: https://wandb.ai/hetarthvader/huggingface
wandb: Synced 6 W&B file(s), 0 media file(s), 0 artifact file(s) and 0 other file(s)
wandb: Find logs at: /scratch/bbvz/choprahetarth/wandb/run-20240706_171557-9de71616/logs
wandb: WARNING The new W&B backend becomes opt-out in version 0.18.0; try it out with `wandb.require("core")`! See https://wandb.me/wandb-core for more information.


srun --unbuffered --account=bbvz-delta-gpu \
python -m torch.distributed.run \
--nproc_per_node=4 \
finetune.py \
--model_id="bigcode/starcoderbase-3b" \
--dataset_name="/u/choprahetarth/all_files/data/train_ftdata-new-small.json" \
--max_seq_length 512 \
--max_steps 428 \
--size_valid_set 1525 \
--micro_batch_size 2 \
--gradient_accumulation_steps 4 \
--weight_decay 0.01 \
--fp16 True \
--lora_rank 16 \
--learning_rate 2e-4 \
--lr_scheduler_type="cosine" \
--warmup_steps 100 \
--seed 1234 \
--output_dir="//scratch/bbvz/choprahetarth/starcoder2_script/starcoderbase-3b" \
--push_to_hub False \
--save_freq 20