Running "module reset". Resetting modules to system default. The following $MODULEPATH directories have been removed: None
WARNING:__main__:
*****************************************
Setting OMP_NUM_THREADS environment variable for each process to be 1 in default, to avoid your system being overloaded, please further tune the variable for optimal performance in your application as needed. 
*****************************************
/u/choprahetarth/all_files/starcoder2
/u/choprahetarth/all_files/starcoder2
/u/choprahetarth/all_files/starcoder2
/u/choprahetarth/all_files/starcoder2
Loading BNB
Loading BNB
Loading BNB
Loading BNB
Loading Model
Loading Model
Loading Model
Loading Model
Model Loaded
Model Loaded
Model Loaded
Model Loaded
Setting num_proc from 64 back to 1 for the train split to disable multiprocessing as it only contains one shard.

Generating train split: 0 examples [00:00, ? examples/s]
Generating train split: 15246 examples [00:01, 11466.14 examples/s]
Generating train split: 15246 examples [00:01, 11455.24 examples/s]

Map:   0%|          | 0/15246 [00:00<?, ? examples/s]
Map:   0%|          | 0/15246 [00:00<?, ? examples/s]
Map:   0%|          | 0/15246 [00:00<?, ? examples/s]
Map:   0%|          | 0/15246 [00:00<?, ? examples/s]
Map:   0%|          | 1/15246 [00:00<41:01,  6.19 examples/s]
Map:   0%|          | 1/15246 [00:00<41:02,  6.19 examples/s]
Map:   0%|          | 1/15246 [00:00<41:03,  6.19 examples/s]
Map:   0%|          | 1/15246 [00:00<41:04,  6.19 examples/s]
Map:  15%|█▌        | 2325/15246 [00:00<00:01, 10911.62 examples/s]
Map:  14%|█▁        | 2189/15246 [00:00<00:01, 10268.24 examples/s]
Map:  15%|█▁        | 2231/15246 [00:00<00:01, 10462.70 examples/s]
Map:  15%|█▁        | 2211/15246 [00:00<00:01, 10370.66 examples/s]
Map:  27%|██▋       | 4122/15246 [00:00<00:00, 13743.53 examples/s]
Map:  26%|██▋       | 4013/15246 [00:00<00:00, 13438.70 examples/s]
Map:  26%|██▌       | 3952/15246 [00:00<00:00, 13219.05 examples/s]
Map:  26%|██▋       | 4011/15246 [00:00<00:00, 13403.56 examples/s]
Map:  43%|████▎     | 6498/15246 [00:00<00:00, 17391.34 examples/s]
Map:  42%|████▁     | 6347/15246 [00:00<00:00, 17043.40 examples/s]
Map:  41%|████      | 6248/15246 [00:00<00:00, 16766.18 examples/s]
Map:  42%|████▁     | 6340/15246 [00:00<00:00, 17002.27 examples/s]
Map:  58%|█████▊    | 8874/15246 [00:00<00:00, 19567.96 examples/s]
Map:  57%|█████▋    | 8680/15246 [00:00<00:00, 19192.03 examples/s]
Map:  56%|█████▌    | 8562/15246 [00:00<00:00, 18945.24 examples/s]
Map:  57%|█████▋    | 8652/15246 [00:00<00:00, 19093.47 examples/s]
Map:  74%|███████▁  | 11248/15246 [00:00<00:00, 20934.99 examples/s]
Map:  71%|███████   | 10847/15246 [00:00<00:00, 20224.88 examples/s]
Map:  72%|███████▁  | 10946/15246 [00:00<00:00, 20353.83 examples/s]
Map:  72%|███████▁  | 11000/15246 [00:00<00:00, 20464.85 examples/s]
Map:  89%|████████▉ | 13636/15246 [00:00<00:00, 21872.68 examples/s]
Map:  87%|████████▋ | 13228/15246 [00:00<00:00, 21137.97 examples/s]
Map:  87%|████████▋ | 13334/15246 [00:00<00:00, 21378.38 examples/s]
Map:  86%|████████▌ | 13148/15246 [00:00<00:00, 21047.40 examples/s]
Map: 100%|██████████| 15246/15246 [00:00<00:00, 18245.06 examples/s]

Map: 100%|██████████| 15246/15246 [00:00<00:00, 17928.45 examples/s]

Map: 100%|██████████| 15246/15246 [00:00<00:00, 17827.97 examples/s]

Map: 100%|██████████| 15246/15246 [00:00<00:00, 17722.88 examples/s]
Sample from the training dataset: Sample from the training dataset:   Sample from the training dataset: Sample from the training dataset: {'prompt': 'Given this Ansible Name Field, please generate the ansible task. name: Ensure fail2ban service is enabled and started', 'completion': 'service:\n  name: fail2ban\n  state: started\n  enabled: true\nwhen: centos_base_fail2ban_configuration|bool\n'}{'prompt': 'Given this Ansible Name Field, please generate the ansible task. name: Ensure fail2ban service is enabled and started', 'completion': 'service:\n  name: fail2ban\n  state: started\n  enabled: true\nwhen: centos_base_fail2ban_configuration|bool\n'}  

{'prompt': 'Given this Ansible Name Field, please generate the ansible task. name: Ensure fail2ban service is enabled and started', 'completion': 'service:\n  name: fail2ban\n  state: started\n  enabled: true\nwhen: centos_base_fail2ban_configuration|bool\n'}{'prompt': 'Given this Ansible Name Field, please generate the ansible task. name: Ensure fail2ban service is enabled and started', 'completion': 'service:\n  name: fail2ban\n  state: started\n  enabled: true\nwhen: centos_base_fail2ban_configuration|bool\n'}

/u/choprahetarth/.conda/envs/scoder_2/lib/python3.10/site-packages/huggingface_hub/utils/_deprecation.py:100: FutureWarning: Deprecated argument(s) used in '__init__': max_seq_length. Will not be supported from version '1.0.0'.

Deprecated positional argument(s) used in SFTTrainer, please use the SFTConfig to set these arguments instead.
  warnings.warn(message, FutureWarning)
/u/choprahetarth/.conda/envs/scoder_2/lib/python3.10/site-packages/huggingface_hub/utils/_deprecation.py:100: FutureWarning: Deprecated argument(s) used in '__init__': max_seq_length. Will not be supported from version '1.0.0'.

Deprecated positional argument(s) used in SFTTrainer, please use the SFTConfig to set these arguments instead.
  warnings.warn(message, FutureWarning)
/u/choprahetarth/.conda/envs/scoder_2/lib/python3.10/site-packages/huggingface_hub/utils/_deprecation.py:100: FutureWarning: Deprecated argument(s) used in '__init__': max_seq_length. Will not be supported from version '1.0.0'.

Deprecated positional argument(s) used in SFTTrainer, please use the SFTConfig to set these arguments instead.
  warnings.warn(message, FutureWarning)
/u/choprahetarth/.conda/envs/scoder_2/lib/python3.10/site-packages/huggingface_hub/utils/_deprecation.py:100: FutureWarning: Deprecated argument(s) used in '__init__': max_seq_length. Will not be supported from version '1.0.0'.

Deprecated positional argument(s) used in SFTTrainer, please use the SFTConfig to set these arguments instead.
  warnings.warn(message, FutureWarning)
/u/choprahetarth/.conda/envs/scoder_2/lib/python3.10/site-packages/transformers/training_args.py:1965: FutureWarning: `--push_to_hub_token` is deprecated and will be removed in version 5 of 🤗 Transformers. Use `--hub_token` instead.
  warnings.warn(
/u/choprahetarth/.conda/envs/scoder_2/lib/python3.10/site-packages/transformers/training_args.py:1965: FutureWarning: `--push_to_hub_token` is deprecated and will be removed in version 5 of 🤗 Transformers. Use `--hub_token` instead.
  warnings.warn(
/u/choprahetarth/.conda/envs/scoder_2/lib/python3.10/site-packages/transformers/training_args.py:1965: FutureWarning: `--push_to_hub_token` is deprecated and will be removed in version 5 of 🤗 Transformers. Use `--hub_token` instead.
  warnings.warn(
/u/choprahetarth/.conda/envs/scoder_2/lib/python3.10/site-packages/transformers/training_args.py:1965: FutureWarning: `--push_to_hub_token` is deprecated and will be removed in version 5 of 🤗 Transformers. Use `--hub_token` instead.
  warnings.warn(
/u/choprahetarth/.conda/envs/scoder_2/lib/python3.10/site-packages/transformers/training_args.py:1965: FutureWarning: `--push_to_hub_token` is deprecated and will be removed in version 5 of 🤗 Transformers. Use `--hub_token` instead.
  warnings.warn(
/u/choprahetarth/.conda/envs/scoder_2/lib/python3.10/site-packages/transformers/training_args.py:1965: FutureWarning: `--push_to_hub_token` is deprecated and will be removed in version 5 of 🤗 Transformers. Use `--hub_token` instead.
  warnings.warn(
/u/choprahetarth/.conda/envs/scoder_2/lib/python3.10/site-packages/transformers/training_args.py:1965: FutureWarning: `--push_to_hub_token` is deprecated and will be removed in version 5 of 🤗 Transformers. Use `--hub_token` instead.
  warnings.warn(
/u/choprahetarth/.conda/envs/scoder_2/lib/python3.10/site-packages/transformers/training_args.py:1965: FutureWarning: `--push_to_hub_token` is deprecated and will be removed in version 5 of 🤗 Transformers. Use `--hub_token` instead.
  warnings.warn(
/u/choprahetarth/.conda/envs/scoder_2/lib/python3.10/site-packages/trl/trainer/sft_trainer.py:269: UserWarning: You passed a `max_seq_length` argument to the SFTTrainer, the value you passed will override the one in the `SFTConfig`.
  warnings.warn(
/u/choprahetarth/.conda/envs/scoder_2/lib/python3.10/site-packages/trl/trainer/sft_trainer.py:269: UserWarning: You passed a `max_seq_length` argument to the SFTTrainer, the value you passed will override the one in the `SFTConfig`.
  warnings.warn(
/u/choprahetarth/.conda/envs/scoder_2/lib/python3.10/site-packages/trl/trainer/sft_trainer.py:269: UserWarning: You passed a `max_seq_length` argument to the SFTTrainer, the value you passed will override the one in the `SFTConfig`.
  warnings.warn(
/u/choprahetarth/.conda/envs/scoder_2/lib/python3.10/site-packages/trl/trainer/sft_trainer.py:355: UserWarning: You passed a `dataset_kwargs` argument to the SFTTrainer, the value you passed will override the one in the `SFTConfig`.
  warnings.warn(
/u/choprahetarth/.conda/envs/scoder_2/lib/python3.10/site-packages/trl/trainer/sft_trainer.py:269: UserWarning: You passed a `max_seq_length` argument to the SFTTrainer, the value you passed will override the one in the `SFTConfig`.
  warnings.warn(

Map:   0%|          | 0/13721 [00:00<?, ? examples/s]
Map:   7%|▋         | 1000/13721 [00:00<00:11, 1097.04 examples/s]
Map:  22%|██▁       | 3000/13721 [00:01<00:03, 3567.75 examples/s]
Map:  36%|███▋      | 5000/13721 [00:01<00:01, 6097.97 examples/s]
Map:  51%|█████     | 7000/13721 [00:01<00:00, 8499.77 examples/s]
Map:  66%|██████▌   | 9000/13721 [00:01<00:00, 10688.20 examples/s]
Map:  80%|████████  | 11000/13721 [00:01<00:00, 12535.94 examples/s]
Map:  95%|█████████▁| 13000/13721 [00:01<00:00, 13954.95 examples/s]
Map: 100%|██████████| 13721/13721 [00:01<00:00, 8329.27 examples/s] 

Map:   0%|          | 0/1525 [00:00<?, ? examples/s]
Map: 100%|██████████| 1525/1525 [00:00<00:00, 14922.24 examples/s]
Map: 100%|██████████| 1525/1525 [00:00<00:00, 14462.79 examples/s]
/u/choprahetarth/.conda/envs/scoder_2/lib/python3.10/site-packages/trl/trainer/sft_trainer.py:355: UserWarning: You passed a `dataset_kwargs` argument to the SFTTrainer, the value you passed will override the one in the `SFTConfig`.
  warnings.warn(
/u/choprahetarth/.conda/envs/scoder_2/lib/python3.10/site-packages/trl/trainer/sft_trainer.py:355: UserWarning: You passed a `dataset_kwargs` argument to the SFTTrainer, the value you passed will override the one in the `SFTConfig`.
  warnings.warn(
/u/choprahetarth/.conda/envs/scoder_2/lib/python3.10/site-packages/trl/trainer/sft_trainer.py:355: UserWarning: You passed a `dataset_kwargs` argument to the SFTTrainer, the value you passed will override the one in the `SFTConfig`.
  warnings.warn(
WARNING:accelerate.utils.other:Detected kernel version 4.18.0, which is below the recommended minimum of 5.5.0; this can cause the process to hang. It is recommended to upgrade the kernel to the minimum version or higher.

Map:   0%|          | 0/1525 [00:00<?, ? examples/s]
Map:   0%|          | 0/1525 [00:00<?, ? examples/s]
Map:   0%|          | 0/1525 [00:00<?, ? examples/s]
Map:  66%|██████▌   | 1000/1525 [00:00<00:00, 7900.07 examples/s]
Map:  66%|██████▌   | 1000/1525 [00:00<00:00, 7664.48 examples/s]
Map:  66%|██████▌   | 1000/1525 [00:00<00:00, 7386.47 examples/s]
Map: 100%|██████████| 1525/1525 [00:00<00:00, 8965.77 examples/s]

Map: 100%|██████████| 1525/1525 [00:00<00:00, 8817.93 examples/s]

Map: 100%|██████████| 1525/1525 [00:00<00:00, 8901.34 examples/s]
max_steps is given, it will override any value given in num_train_epochs
max_steps is given, it will override any value given in num_train_epochs
max_steps is given, it will override any value given in num_train_epochs
Training...
Training...
Training...
Training...
wandb: Currently logged in as: hetarthvader. Use `wandb login --relogin` to force relogin
wandb: wandb version 0.17.4 is available!  To upgrade, please run:
wandb:  $ pip install wandb --upgrade
wandb: Tracking run with wandb version 0.17.2
wandb: Run data is saved locally in /scratch/bbvz/choprahetarth/wandb/run-20240714_150414-lk9wiwri
wandb: Run `wandb offline` to turn off syncing.
wandb: Syncing run train-WizardCoder-15B-V1.0
wandb: ⭐️ View project at https://wandb.ai/hetarthvader/huggingface
wandb: 🚀 View run at https://wandb.ai/hetarthvader/huggingface/runs/lk9wiwri
/u/choprahetarth/.conda/envs/scoder_2/lib/python3.10/site-packages/bitsandbytes/autograd/_functions.py:316: UserWarning: MatMul8bitLt: inputs will be cast from torch.float32 to float16 during quantization
  warnings.warn(f"MatMul8bitLt: inputs will be cast from {A.dtype} to float16 during quantization")
/u/choprahetarth/.conda/envs/scoder_2/lib/python3.10/site-packages/bitsandbytes/autograd/_functions.py:316: UserWarning: MatMul8bitLt: inputs will be cast from torch.float32 to float16 during quantization
  warnings.warn(f"MatMul8bitLt: inputs will be cast from {A.dtype} to float16 during quantization")
/u/choprahetarth/.conda/envs/scoder_2/lib/python3.10/site-packages/bitsandbytes/autograd/_functions.py:316: UserWarning: MatMul8bitLt: inputs will be cast from torch.float32 to float16 during quantization
  warnings.warn(f"MatMul8bitLt: inputs will be cast from {A.dtype} to float16 during quantization")
/u/choprahetarth/.conda/envs/scoder_2/lib/python3.10/site-packages/bitsandbytes/autograd/_functions.py:316: UserWarning: MatMul8bitLt: inputs will be cast from torch.float32 to float16 during quantization
  warnings.warn(f"MatMul8bitLt: inputs will be cast from {A.dtype} to float16 during quantization")
[rank0]:[W reducer.cpp:1389] Warning: find_unused_parameters=True was specified in DDP constructor, but did not find any unused parameters in the forward pass. This flag results in an extra traversal of the autograd graph every iteration,  which can adversely affect performance. If your model indeed never has any unused parameters in the forward pass, consider turning this flag off. Note that this warning may be a false positive if your model has flow control causing later iterations to have unused parameters. (function operator())
[rank3]:[W reducer.cpp:1389] Warning: find_unused_parameters=True was specified in DDP constructor, but did not find any unused parameters in the forward pass. This flag results in an extra traversal of the autograd graph every iteration,  which can adversely affect performance. If your model indeed never has any unused parameters in the forward pass, consider turning this flag off. Note that this warning may be a false positive if your model has flow control causing later iterations to have unused parameters. (function operator())
[rank1]:[W reducer.cpp:1389] Warning: find_unused_parameters=True was specified in DDP constructor, but did not find any unused parameters in the forward pass. This flag results in an extra traversal of the autograd graph every iteration,  which can adversely affect performance. If your model indeed never has any unused parameters in the forward pass, consider turning this flag off. Note that this warning may be a false positive if your model has flow control causing later iterations to have unused parameters. (function operator())
[rank2]:[W reducer.cpp:1389] Warning: find_unused_parameters=True was specified in DDP constructor, but did not find any unused parameters in the forward pass. This flag results in an extra traversal of the autograd graph every iteration,  which can adversely affect performance. If your model indeed never has any unused parameters in the forward pass, consider turning this flag off. Note that this warning may be a false positive if your model has flow control causing later iterations to have unused parameters. (function operator())
{'loss': 3.3299, 'grad_norm': 0.31971365213394165, 'learning_rate': 4e-05, 'epoch': 0.046620046620046623}
{'loss': 2.5352, 'grad_norm': 0.636067271232605, 'learning_rate': 8e-05, 'epoch': 0.09324009324009325}
{'loss': 1.4155, 'grad_norm': 0.320272833108902, 'learning_rate': 0.00012, 'epoch': 0.13986013986013987}
{'loss': 1.0935, 'grad_norm': 0.23805290460586548, 'learning_rate': 0.00016, 'epoch': 0.1864801864801865}
{'loss': 1.0294, 'grad_norm': 0.26316237449645996, 'learning_rate': 0.0002, 'epoch': 0.2331002331002331}
{'loss': 0.9818, 'grad_norm': 0.2522856295108795, 'learning_rate': 0.00019818190089671508, 'epoch': 0.27972027972027974}
{'loss': 0.9747, 'grad_norm': 0.24869632720947266, 'learning_rate': 0.0001927937132738476, 'epoch': 0.32634032634032634}
{'loss': 0.9868, 'grad_norm': 0.2963550090789795, 'learning_rate': 0.00018403136231310684, 'epoch': 0.372960372960373}
{'loss': 0.9307, 'grad_norm': 0.2634473741054535, 'learning_rate': 0.0001722134644629807, 'epoch': 0.4195804195804196}
{'loss': 0.9144, 'grad_norm': 0.22984039783477783, 'learning_rate': 0.0001577697419131497, 'epoch': 0.4662004662004662}
{'loss': 0.9001, 'grad_norm': 0.2842773199081421, 'learning_rate': 0.00014122539704393265, 'epoch': 0.5128205128205128}
{'loss': 0.9072, 'grad_norm': 0.25263410806655884, 'learning_rate': 0.00012318201502675285, 'epoch': 0.5594405594405595}
{'loss': 0.928, 'grad_norm': 0.23079101741313934, 'learning_rate': 0.00010429568899492348, 'epoch': 0.6060606060606061}
{'loss': 0.9008, 'grad_norm': 0.2716630697250366, 'learning_rate': 8.525316319690092e-05, 'epoch': 0.6526806526806527}
{'loss': 0.9231, 'grad_norm': 0.3074215352535248, 'learning_rate': 6.674686161423843e-05, 'epoch': 0.6993006993006993}
{'loss': 0.8917, 'grad_norm': 0.25353649258613586, 'learning_rate': 4.944971005318716e-05, 'epoch': 0.745920745920746}
{'loss': 0.8912, 'grad_norm': 0.27072882652282715, 'learning_rate': 3.399066722859782e-05, 'epoch': 0.7925407925407926}
{'loss': 0.863, 'grad_norm': 0.3272359073162079, 'learning_rate': 2.0931854578410905e-05, 'epoch': 0.8391608391608392}
{'loss': 0.8964, 'grad_norm': 0.3129606246948242, 'learning_rate': 1.0748116414011888e-05, 'epoch': 0.8857808857808858}
{'loss': 0.8965, 'grad_norm': 0.2822198271751404, 'learning_rate': 3.8097536398963963e-06, 'epoch': 0.9324009324009324}
{'loss': 0.8993, 'grad_norm': 0.2647600471973419, 'learning_rate': 3.6905887882213717e-07, 'epoch': 0.9790209790209791}
{'train_runtime': 2226.6826, 'train_samples_per_second': 6.165, 'train_steps_per_second': 0.193, 'train_loss': 1.1403665953860693, 'epoch': 1.0}
GPTBigCodeForCausalLM(
  (transformer): GPTBigCodeModel(
    (wte): Embedding(49153, 6144)
    (wpe): Embedding(8192, 6144)
    (drop): Dropout(p=0.1, inplace=False)
    (h): ModuleList(
      (0-39): 40 x GPTBigCodeBlock(
        (ln_1): LayerNorm((6144,), eps=1e-05, elementwise_affine=True)
        (attn): GPTBigCodeSdpaAttention(
          (c_attn): lora.Linear8bitLt(
            (base_layer): Linear8bitLt(in_features=6144, out_features=6400, bias=True)
            (lora_dropout): ModuleDict(
              (default): Identity()
            )
            (lora_A): ModuleDict(
              (default): Linear(in_features=6144, out_features=16, bias=False)
            )
            (lora_B): ModuleDict(
              (default): Linear(in_features=16, out_features=6400, bias=False)
            )
            (lora_embedding_A): ParameterDict()
            (lora_embedding_B): ParameterDict()
          )
          (c_proj): lora.Linear8bitLt(
            (base_layer): Linear8bitLt(in_features=6144, out_features=6144, bias=True)
            (lora_dropout): ModuleDict(
              (default): Identity()
            )
            (lora_A): ModuleDict(
              (default): Linear(in_features=6144, out_features=16, bias=False)
            )
            (lora_B): ModuleDict(
              (default): Linear(in_features=16, out_features=6144, bias=False)
            )
            (lora_embedding_A): ParameterDict()
            (lora_embedding_B): ParameterDict()
          )
          (attn_dropout): Dropout(p=0.1, inplace=False)
          (resid_dropout): Dropout(p=0.1, inplace=False)
        )
        (ln_2): LayerNorm((6144,), eps=1e-05, elementwise_affine=True)
        (mlp): GPTBigCodeMLP(
          (c_fc): Linear8bitLt(in_features=6144, out_features=24576, bias=True)
          (c_proj): lora.Linear8bitLt(
            (base_layer): Linear8bitLt(in_features=24576, out_features=6144, bias=True)
            (lora_dropout): ModuleDict(
              (default): Identity()
            )
            (lora_A): ModuleDict(
              (default): Linear(in_features=24576, out_features=16, bias=False)
            )
            (lora_B): ModuleDict(
              (default): Linear(in_features=16, out_features=6144, bias=False)
            )
            (lora_embedding_A): ParameterDict()
            (lora_embedding_B): ParameterDict()
          )
          (act): GELUActivation()
          (dropout): Dropout(p=0.1, inplace=False)
        )
      )
    )
    (ln_f): LayerNorm((6144,), eps=1e-05, elementwise_affine=True)
  )
  (lm_head): Linear(in_features=6144, out_features=49153, bias=False)
)
GPTBigCodeForCausalLM(
  (transformer): GPTBigCodeModel(
    (wte): Embedding(49153, 6144)
    (wpe): Embedding(8192, 6144)
    (drop): Dropout(p=0.1, inplace=False)
    (h): ModuleList(
      (0-39): 40 x GPTBigCodeBlock(
        (ln_1): LayerNorm((6144,), eps=1e-05, elementwise_affine=True)
        (attn): GPTBigCodeSdpaAttention(
          (c_attn): lora.Linear8bitLt(
            (base_layer): Linear8bitLt(in_features=6144, out_features=6400, bias=True)
            (lora_dropout): ModuleDict(
              (default): Identity()
            )
            (lora_A): ModuleDict(
              (default): Linear(in_features=6144, out_features=16, bias=False)
            )
            (lora_B): ModuleDict(
              (default): Linear(in_features=16, out_features=6400, bias=False)
            )
            (lora_embedding_A): ParameterDict()
            (lora_embedding_B): ParameterDict()
          )
          (c_proj): lora.Linear8bitLt(
            (base_layer): Linear8bitLt(in_features=6144, out_features=6144, bias=True)
            (lora_dropout): ModuleDict(
              (default): Identity()
            )
            (lora_A): ModuleDict(
              (default): Linear(in_features=6144, out_features=16, bias=False)
            )
            (lora_B): ModuleDict(
              (default): Linear(in_features=16, out_features=6144, bias=False)
            )
            (lora_embedding_A): ParameterDict()
            (lora_embedding_B): ParameterDict()
          )
          (attn_dropout): Dropout(p=0.1, inplace=False)
          (resid_dropout): Dropout(p=0.1, inplace=False)
        )
        (ln_2): LayerNorm((6144,), eps=1e-05, elementwise_affine=True)
        (mlp): GPTBigCodeMLP(
          (c_fc): Linear8bitLt(in_features=6144, out_features=24576, bias=True)
          (c_proj): lora.Linear8bitLt(
            (base_layer): Linear8bitLt(in_features=24576, out_features=6144, bias=True)
            (lora_dropout): ModuleDict(
              (default): Identity()
            )
            (lora_A): ModuleDict(
              (default): Linear(in_features=24576, out_features=16, bias=False)
            )
            (lora_B): ModuleDict(
              (default): Linear(in_features=16, out_features=6144, bias=False)
            )
            (lora_embedding_A): ParameterDict()
            (lora_embedding_B): ParameterDict()
          )
          (act): GELUActivation()
          (dropout): Dropout(p=0.1, inplace=False)
        )
      )
    )
    (ln_f): LayerNorm((6144,), eps=1e-05, elementwise_affine=True)
  )
  (lm_head): Linear(in_features=6144, out_features=49153, bias=False)
)GPTBigCodeForCausalLM(
  (transformer): GPTBigCodeModel(
    (wte): Embedding(49153, 6144)
    (wpe): Embedding(8192, 6144)
    (drop): Dropout(p=0.1, inplace=False)
    (h): ModuleList(
      (0-39): 40 x GPTBigCodeBlock(
        (ln_1): LayerNorm((6144,), eps=1e-05, elementwise_affine=True)
        (attn): GPTBigCodeSdpaAttention(
          (c_attn): lora.Linear8bitLt(
            (base_layer): Linear8bitLt(in_features=6144, out_features=6400, bias=True)
            (lora_dropout): ModuleDict(
              (default): Identity()
            )
            (lora_A): ModuleDict(
              (default): Linear(in_features=6144, out_features=16, bias=False)
            )
            (lora_B): ModuleDict(
              (default): Linear(in_features=16, out_features=6400, bias=False)
            )
            (lora_embedding_A): ParameterDict()
            (lora_embedding_B): ParameterDict()
          )
          (c_proj): lora.Linear8bitLt(
            (base_layer): Linear8bitLt(in_features=6144, out_features=6144, bias=True)
            (lora_dropout): ModuleDict(
              (default): Identity()
            )
            (lora_A): ModuleDict(
              (default): Linear(in_features=6144, out_features=16, bias=False)
            )
            (lora_B): ModuleDict(
              (default): Linear(in_features=16, out_features=6144, bias=False)
            )
            (lora_embedding_A): ParameterDict()
            (lora_embedding_B): ParameterDict()
          )
          (attn_dropout): Dropout(p=0.1, inplace=False)
          (resid_dropout): Dropout(p=0.1, inplace=False)
        )
        (ln_2): LayerNorm((6144,), eps=1e-05, elementwise_affine=True)
        (mlp): GPTBigCodeMLP(
          (c_fc): Linear8bitLt(in_features=6144, out_features=24576, bias=True)
          (c_proj): lora.Linear8bitLt(
            (base_layer): Linear8bitLt(in_features=24576, out_features=6144, bias=True)
            (lora_dropout): ModuleDict(
              (default): Identity()
            )
            (lora_A): ModuleDict(
              (default): Linear(in_features=24576, out_features=16, bias=False)
            )
            (lora_B): ModuleDict(
              (default): Linear(in_features=16, out_features=6144, bias=False)
            )
            (lora_embedding_A): ParameterDict()
            (lora_embedding_B): ParameterDict()
          )
          (act): GELUActivation()
          (dropout): Dropout(p=0.1, inplace=False)
        )
      )
    )
    (ln_f): LayerNorm((6144,), eps=1e-05, elementwise_affine=True)
  )
  (lm_head): Linear(in_features=6144, out_features=49153, bias=False)
)Saving the last checkpoint of the model
Saving the last checkpoint of the model
saving the model peft layer

saving the model peft layer

Saving the last checkpoint of the model
saving the model peft layer
GPTBigCodeForCausalLM(
  (transformer): GPTBigCodeModel(
    (wte): Embedding(49153, 6144)
    (wpe): Embedding(8192, 6144)
    (drop): Dropout(p=0.1, inplace=False)
    (h): ModuleList(
      (0-39): 40 x GPTBigCodeBlock(
        (ln_1): LayerNorm((6144,), eps=1e-05, elementwise_affine=True)
        (attn): GPTBigCodeSdpaAttention(
          (c_attn): lora.Linear8bitLt(
            (base_layer): Linear8bitLt(in_features=6144, out_features=6400, bias=True)
            (lora_dropout): ModuleDict(
              (default): Identity()
            )
            (lora_A): ModuleDict(
              (default): Linear(in_features=6144, out_features=16, bias=False)
            )
            (lora_B): ModuleDict(
              (default): Linear(in_features=16, out_features=6400, bias=False)
            )
            (lora_embedding_A): ParameterDict()
            (lora_embedding_B): ParameterDict()
          )
          (c_proj): lora.Linear8bitLt(
            (base_layer): Linear8bitLt(in_features=6144, out_features=6144, bias=True)
            (lora_dropout): ModuleDict(
              (default): Identity()
            )
            (lora_A): ModuleDict(
              (default): Linear(in_features=6144, out_features=16, bias=False)
            )
            (lora_B): ModuleDict(
              (default): Linear(in_features=16, out_features=6144, bias=False)
            )
            (lora_embedding_A): ParameterDict()
            (lora_embedding_B): ParameterDict()
          )
          (attn_dropout): Dropout(p=0.1, inplace=False)
          (resid_dropout): Dropout(p=0.1, inplace=False)
        )
        (ln_2): LayerNorm((6144,), eps=1e-05, elementwise_affine=True)
        (mlp): GPTBigCodeMLP(
          (c_fc): Linear8bitLt(in_features=6144, out_features=24576, bias=True)
          (c_proj): lora.Linear8bitLt(
            (base_layer): Linear8bitLt(in_features=24576, out_features=6144, bias=True)
            (lora_dropout): ModuleDict(
              (default): Identity()
            )
            (lora_A): ModuleDict(
              (default): Linear(in_features=24576, out_features=16, bias=False)
            )
            (lora_B): ModuleDict(
              (default): Linear(in_features=16, out_features=6144, bias=False)
            )
            (lora_embedding_A): ParameterDict()
            (lora_embedding_B): ParameterDict()
          )
          (act): GELUActivation()
          (dropout): Dropout(p=0.1, inplace=False)
        )
      )
    )
    (ln_f): LayerNorm((6144,), eps=1e-05, elementwise_affine=True)
  )
  (lm_head): Linear(in_features=6144, out_features=49153, bias=False)
)
Saving the last checkpoint of the model
saving the model peft layer
/u/choprahetarth/.conda/envs/scoder_2/lib/python3.10/site-packages/huggingface_hub/file_download.py:1132: FutureWarning: `resume_download` is deprecated and will be removed in version 1.0.0. Downloads always resume when possible. If you want to force a new download, use `force_download=True`.
  warnings.warn(
/u/choprahetarth/.conda/envs/scoder_2/lib/python3.10/site-packages/huggingface_hub/file_download.py:1132: FutureWarning: `resume_download` is deprecated and will be removed in version 1.0.0. Downloads always resume when possible. If you want to force a new download, use `force_download=True`.
  warnings.warn(
/u/choprahetarth/.conda/envs/scoder_2/lib/python3.10/site-packages/huggingface_hub/file_download.py:1132: FutureWarning: `resume_download` is deprecated and will be removed in version 1.0.0. Downloads always resume when possible. If you want to force a new download, use `force_download=True`.
  warnings.warn(
/u/choprahetarth/.conda/envs/scoder_2/lib/python3.10/site-packages/huggingface_hub/file_download.py:1132: FutureWarning: `resume_download` is deprecated and will be removed in version 1.0.0. Downloads always resume when possible. If you want to force a new download, use `force_download=True`.
  warnings.warn(
Deleted all GPU Memory
Merging the Lora layers back
Deleted all GPU Memory
Merging the Lora layers back
Deleted all GPU Memory
Merging the Lora layers back
Deleted all GPU Memory
Merging the Lora layers back
Loading PEFT model...
Merging and unloading model...
Loading PEFT model...
Loading tokenizer...
Saving pretrained model and tokenizer...
Loading PEFT model...
Merging and unloading model...
Loading PEFT model...
Loading tokenizer...
Merging and unloading model...
Saving pretrained model and tokenizer...
Loading tokenizer...
Saving pretrained model and tokenizer...
Merging and unloading model...
Loading tokenizer...
Saving pretrained model and tokenizer...
Training Done! 💥
Training Done! 💥
Training Done! 💥
Training Done! 💥
wandb: - 0.008 MB of 0.008 MB uploaded
wandb: \ 0.029 MB of 0.029 MB uploaded
wandb: 
wandb: Run history:
wandb:         train/epoch ▁▁▂▂▂▃▃▃▄▄▄▅▅▅▆▆▆▇▇███
wandb:   train/global_step ▁▁▂▂▂▃▃▃▄▄▄▅▅▅▆▆▆▇▇███
wandb:     train/grad_norm ▃█▃▁▂▁▁▂▂▁▂▁▁▂▂▁▂▃▂▂▂
wandb: train/learning_rate ▂▄▅▇███▇▇▇▆▅▅▄▃▃▂▂▁▁▁
wandb:          train/loss █▆▃▂▁▁▁▁▁▁▁▁▁▁▁▁▁▁▁▁▁
wandb: 
wandb: Run summary:
wandb:               total_flos 1.1562895895062118e+17
wandb:              train/epoch 1.0
wandb:        train/global_step 429
wandb:          train/grad_norm 0.26476
wandb:      train/learning_rate 0.0
wandb:               train/loss 0.8993
wandb:               train_loss 1.14037
wandb:            train_runtime 2226.6826
wandb: train_samples_per_second 6.165
wandb:   train_steps_per_second 0.193
wandb: 
wandb: 🚀 View run train-WizardCoder-15B-V1.0 at: https://wandb.ai/hetarthvader/huggingface/runs/lk9wiwri
wandb: ⭐️ View project at: https://wandb.ai/hetarthvader/huggingface
wandb: Synced 5 W&B file(s), 0 media file(s), 0 artifact file(s) and 0 other file(s)
wandb: Find logs at: /scratch/bbvz/choprahetarth/wandb/run-20240714_150414-lk9wiwri/logs
wandb: WARNING The new W&B backend becomes opt-out in version 0.18.0; try it out with `wandb.require("core")`! See https://wandb.me/wandb-core for more information.


srun --unbuffered --account=bbvz-delta-gpu \
python -m torch.distributed.run \
--nproc_per_node=4 \
finetune.py \
--model_id="WizardLMTeam/WizardCoder-15B-V1.0" \
--dataset_name="/u/choprahetarth/all_files/data/train_ftdata-new-small.json" \
--max_seq_length 512 \
--max_steps 429 \
--size_valid_set 1525 \
--micro_batch_size 2 \
--gradient_accumulation_steps 4 \
--weight_decay 0.01 \
--fp16 True \
--lora_rank 16 \
--learning_rate 2e-4 \
--lr_scheduler_type="cosine" \
--warmup_steps 100 \
--seed 1234 \
--output_dir="//scratch/bbvz/choprahetarth/starcoder2_script/WizardCoder-15B-V1.0" \
--push_to_hub False \
--save_freq 20