Running "module reset". Resetting modules to system default. The following $MODULEPATH directories have been removed: None
WARNING:__main__:
*****************************************
Setting OMP_NUM_THREADS environment variable for each process to be 1 in default, to avoid your system being overloaded, please further tune the variable for optimal performance in your application as needed. 
*****************************************
/u/choprahetarth/all_files/starcoder2
/u/choprahetarth/all_files/starcoder2
/u/choprahetarth/all_files/starcoder2
/u/choprahetarth/all_files/starcoder2
I am loading LORA
I am loading LORALoading BNB

Loading Model
Loading BNB
Loading Model
I am loading LORA
Loading BNB
Loading Model
I am loading LORA
Loading BNB
Loading Model

Downloading shards:   0%|          | 0/4 [00:00<?, ?it/s]
Downloading shards:   0%|          | 0/4 [00:00<?, ?it/s]
Downloading shards:   0%|          | 0/4 [00:00<?, ?it/s]
Downloading shards:   0%|          | 0/4 [00:00<?, ?it/s]
Downloading shards:  25%|██▌       | 1/4 [00:38<01:55, 38.45s/it]
Downloading shards:  25%|██▌       | 1/4 [00:38<01:55, 38.44s/it]
Downloading shards:  25%|██▌       | 1/4 [00:38<01:55, 38.42s/it]
Downloading shards:  25%|██▌       | 1/4 [00:38<01:55, 38.49s/it]
Downloading shards:  50%|█████     | 2/4 [01:17<01:17, 38.99s/it]
Downloading shards:  50%|█████     | 2/4 [01:17<01:17, 38.94s/it]
Downloading shards:  50%|█████     | 2/4 [01:17<01:17, 38.97s/it]
Downloading shards:  50%|█████     | 2/4 [01:17<01:18, 39.04s/it]
Downloading shards:  75%|███████▌  | 3/4 [01:56<00:38, 39.00s/it]
Downloading shards:  75%|███████▌  | 3/4 [01:56<00:38, 38.97s/it]
Downloading shards:  75%|███████▌  | 3/4 [01:56<00:38, 38.98s/it]
Downloading shards:  75%|███████▌  | 3/4 [01:56<00:39, 39.02s/it]
Downloading shards: 100%|██████████| 4/4 [02:12<00:00, 29.81s/it]
Downloading shards: 100%|██████████| 4/4 [02:12<00:00, 33.12s/it]

Downloading shards: 100%|██████████| 4/4 [02:12<00:00, 29.81s/it]
Downloading shards: 100%|██████████| 4/4 [02:12<00:00, 33.14s/it]

Downloading shards: 100%|██████████| 4/4 [02:12<00:00, 29.86s/it]
Downloading shards: 100%|██████████| 4/4 [02:12<00:00, 33.17s/it]

Downloading shards: 100%|██████████| 4/4 [02:12<00:00, 29.85s/it]
Downloading shards: 100%|██████████| 4/4 [02:12<00:00, 33.17s/it]

Loading checkpoint shards:   0%|          | 0/4 [00:00<?, ?it/s]
Loading checkpoint shards:   0%|          | 0/4 [00:00<?, ?it/s]
Loading checkpoint shards:   0%|          | 0/4 [00:00<?, ?it/s]
Loading checkpoint shards:   0%|          | 0/4 [00:00<?, ?it/s]
Loading checkpoint shards:  25%|██▌       | 1/4 [00:07<00:22,  7.48s/it]
Loading checkpoint shards:  25%|██▌       | 1/4 [00:07<00:23,  7.84s/it]
Loading checkpoint shards:  25%|██▌       | 1/4 [00:07<00:23,  7.85s/it]
Loading checkpoint shards:  25%|██▌       | 1/4 [00:07<00:23,  7.85s/it]
Loading checkpoint shards:  50%|█████     | 2/4 [00:11<00:11,  5.66s/it]
Loading checkpoint shards:  50%|█████     | 2/4 [00:12<00:12,  6.03s/it]
Loading checkpoint shards:  50%|█████     | 2/4 [00:12<00:12,  6.04s/it]
Loading checkpoint shards:  50%|█████     | 2/4 [00:12<00:12,  6.04s/it]
Loading checkpoint shards:  75%|███████▌  | 3/4 [00:16<00:05,  5.06s/it]
Loading checkpoint shards:  75%|███████▌  | 3/4 [00:17<00:05,  5.41s/it]
Loading checkpoint shards:  75%|███████▌  | 3/4 [00:17<00:05,  5.41s/it]
Loading checkpoint shards:  75%|███████▌  | 3/4 [00:17<00:05,  5.41s/it]
Loading checkpoint shards: 100%|██████████| 4/4 [00:18<00:00,  3.77s/it]
Loading checkpoint shards: 100%|██████████| 4/4 [00:18<00:00,  4.50s/it]
Model Loaded

Loading checkpoint shards: 100%|██████████| 4/4 [00:19<00:00,  4.02s/it]
Loading checkpoint shards: 100%|██████████| 4/4 [00:19<00:00,  4.79s/it]

Loading checkpoint shards: 100%|██████████| 4/4 [00:19<00:00,  4.03s/it]
Loading checkpoint shards: 100%|██████████| 4/4 [00:19<00:00,  4.80s/it]

Loading checkpoint shards: 100%|██████████| 4/4 [00:19<00:00,  4.04s/it]
Loading checkpoint shards: 100%|██████████| 4/4 [00:19<00:00,  4.80s/it]
Model Loaded
Model Loaded
Model Loaded
Setting num_proc from 64 back to 1 for the train split to disable multiprocessing as it only contains one shard.

Generating train split: 0 examples [00:00, ? examples/s]
Generating train split: 15246 examples [00:01, 12213.44 examples/s]
Generating train split: 15246 examples [00:01, 12129.15 examples/s]

Map:   0%|          | 0/15246 [00:00<?, ? examples/s]
Map:   0%|          | 0/15246 [00:00<?, ? examples/s]
Map:   0%|          | 0/15246 [00:00<?, ? examples/s]
Map:   0%|          | 0/15246 [00:00<?, ? examples/s]
Map:   7%|▋         | 1088/15246 [00:00<00:01, 8493.42 examples/s]
Map:   7%|▋         | 1087/15246 [00:00<00:01, 8484.10 examples/s]
Map:   8%|▊         | 1159/15246 [00:00<00:01, 9036.32 examples/s]
Map:   7%|▋         | 1086/15246 [00:00<00:01, 8465.07 examples/s]
Map:  22%|██▁       | 3408/15246 [00:00<00:00, 16244.70 examples/s]
Map:  23%|██▎       | 3450/15246 [00:00<00:00, 16463.03 examples/s]
Map:  23%|██▎       | 3473/15246 [00:00<00:00, 16463.83 examples/s]
Map:  22%|██▁       | 3380/15246 [00:00<00:00, 16088.11 examples/s]
Map:  38%|███▊      | 5741/15246 [00:00<00:00, 19286.26 examples/s]
Map:  38%|███▊      | 5811/15246 [00:00<00:00, 19528.50 examples/s]
Map:  38%|███▊      | 5813/15246 [00:00<00:00, 19438.55 examples/s]
Map:  37%|███▋      | 5680/15246 [00:00<00:00, 19051.03 examples/s]
Map:  53%|█████▎    | 8042/15246 [00:00<00:00, 20699.68 examples/s]
Map:  53%|█████▎    | 8140/15246 [00:00<00:00, 20954.39 examples/s]
Map:  53%|█████▎    | 8147/15246 [00:00<00:00, 20917.88 examples/s]
Map:  52%|█████▁    | 7984/15246 [00:00<00:00, 20565.01 examples/s]
Map:  68%|██████▊   | 10373/15246 [00:00<00:00, 21614.95 examples/s]
Map:  69%|██████▉   | 10492/15246 [00:00<00:00, 21855.11 examples/s]
Map:  69%|██████▉   | 10501/15246 [00:00<00:00, 21837.02 examples/s]
Map:  67%|██████▋   | 10285/15246 [00:00<00:00, 21420.77 examples/s]
Map:  83%|████████▎ | 12725/15246 [00:00<00:00, 22248.89 examples/s]
Map:  84%|████████▁ | 12853/15246 [00:00<00:00, 22439.92 examples/s]
Map:  84%|████████▁ | 12869/15246 [00:00<00:00, 22448.36 examples/s]
Map:  83%|████████▎ | 12614/15246 [00:00<00:00, 22045.32 examples/s]
Map:  99%|█████████▊| 15052/15246 [00:00<00:00, 22577.48 examples/s]
Map: 100%|█████████▉| 15185/15246 [00:00<00:00, 22677.32 examples/s]
Map:  98%|█████████▊| 14920/15246 [00:00<00:00, 22370.85 examples/s]
Map: 100%|█████████▉| 15184/15246 [00:00<00:00, 22691.42 examples/s]
Map: 100%|██████████| 15246/15246 [00:00<00:00, 20518.19 examples/s]

Map: 100%|██████████| 15246/15246 [00:00<00:00, 20513.52 examples/s]

Map: 100%|██████████| 15246/15246 [00:00<00:00, 20510.56 examples/s]

Map: 100%|██████████| 15246/15246 [00:00<00:00, 20362.39 examples/s]
Sample from the training dataset: Sample from the training dataset: Sample from the training dataset: Sample from the training dataset:     {'prompt': 'Given this Ansible Name Field, please generate the ansible task. name: Ensure fail2ban service is enabled and started', 'completion': 'service:\n  name: fail2ban\n  state: started\n  enabled: true\nwhen: centos_base_fail2ban_configuration|bool\n'}{'prompt': 'Given this Ansible Name Field, please generate the ansible task. name: Ensure fail2ban service is enabled and started', 'completion': 'service:\n  name: fail2ban\n  state: started\n  enabled: true\nwhen: centos_base_fail2ban_configuration|bool\n'}{'prompt': 'Given this Ansible Name Field, please generate the ansible task. name: Ensure fail2ban service is enabled and started', 'completion': 'service:\n  name: fail2ban\n  state: started\n  enabled: true\nwhen: centos_base_fail2ban_configuration|bool\n'}{'prompt': 'Given this Ansible Name Field, please generate the ansible task. name: Ensure fail2ban service is enabled and started', 'completion': 'service:\n  name: fail2ban\n  state: started\n  enabled: true\nwhen: centos_base_fail2ban_configuration|bool\n'}



/u/choprahetarth/.conda/envs/scoder_2/lib/python3.10/site-packages/huggingface_hub/utils/_deprecation.py:100: FutureWarning: Deprecated argument(s) used in '__init__': max_seq_length. Will not be supported from version '1.0.0'.

Deprecated positional argument(s) used in SFTTrainer, please use the SFTConfig to set these arguments instead.
  warnings.warn(message, FutureWarning)
/u/choprahetarth/.conda/envs/scoder_2/lib/python3.10/site-packages/huggingface_hub/utils/_deprecation.py:100: FutureWarning: Deprecated argument(s) used in '__init__': max_seq_length. Will not be supported from version '1.0.0'.

Deprecated positional argument(s) used in SFTTrainer, please use the SFTConfig to set these arguments instead.
  warnings.warn(message, FutureWarning)
/u/choprahetarth/.conda/envs/scoder_2/lib/python3.10/site-packages/huggingface_hub/utils/_deprecation.py:100: FutureWarning: Deprecated argument(s) used in '__init__': max_seq_length. Will not be supported from version '1.0.0'.

Deprecated positional argument(s) used in SFTTrainer, please use the SFTConfig to set these arguments instead.
  warnings.warn(message, FutureWarning)
/u/choprahetarth/.conda/envs/scoder_2/lib/python3.10/site-packages/huggingface_hub/utils/_deprecation.py:100: FutureWarning: Deprecated argument(s) used in '__init__': max_seq_length. Will not be supported from version '1.0.0'.

Deprecated positional argument(s) used in SFTTrainer, please use the SFTConfig to set these arguments instead.
  warnings.warn(message, FutureWarning)
/u/choprahetarth/.conda/envs/scoder_2/lib/python3.10/site-packages/transformers/training_args.py:1965: FutureWarning: `--push_to_hub_token` is deprecated and will be removed in version 5 of 🤗 Transformers. Use `--hub_token` instead.
  warnings.warn(
/u/choprahetarth/.conda/envs/scoder_2/lib/python3.10/site-packages/transformers/training_args.py:1965: FutureWarning: `--push_to_hub_token` is deprecated and will be removed in version 5 of 🤗 Transformers. Use `--hub_token` instead.
  warnings.warn(
/u/choprahetarth/.conda/envs/scoder_2/lib/python3.10/site-packages/transformers/training_args.py:1965: FutureWarning: `--push_to_hub_token` is deprecated and will be removed in version 5 of 🤗 Transformers. Use `--hub_token` instead.
  warnings.warn(
/u/choprahetarth/.conda/envs/scoder_2/lib/python3.10/site-packages/transformers/training_args.py:1965: FutureWarning: `--push_to_hub_token` is deprecated and will be removed in version 5 of 🤗 Transformers. Use `--hub_token` instead.
  warnings.warn(
/u/choprahetarth/.conda/envs/scoder_2/lib/python3.10/site-packages/transformers/training_args.py:1965: FutureWarning: `--push_to_hub_token` is deprecated and will be removed in version 5 of 🤗 Transformers. Use `--hub_token` instead.
  warnings.warn(
/u/choprahetarth/.conda/envs/scoder_2/lib/python3.10/site-packages/transformers/training_args.py:1965: FutureWarning: `--push_to_hub_token` is deprecated and will be removed in version 5 of 🤗 Transformers. Use `--hub_token` instead.
  warnings.warn(
/u/choprahetarth/.conda/envs/scoder_2/lib/python3.10/site-packages/transformers/training_args.py:1965: FutureWarning: `--push_to_hub_token` is deprecated and will be removed in version 5 of 🤗 Transformers. Use `--hub_token` instead.
  warnings.warn(
/u/choprahetarth/.conda/envs/scoder_2/lib/python3.10/site-packages/transformers/training_args.py:1965: FutureWarning: `--push_to_hub_token` is deprecated and will be removed in version 5 of 🤗 Transformers. Use `--hub_token` instead.
  warnings.warn(
/u/choprahetarth/.conda/envs/scoder_2/lib/python3.10/site-packages/trl/trainer/sft_trainer.py:269: UserWarning: You passed a `max_seq_length` argument to the SFTTrainer, the value you passed will override the one in the `SFTConfig`.
  warnings.warn(
/u/choprahetarth/.conda/envs/scoder_2/lib/python3.10/site-packages/trl/trainer/sft_trainer.py:269: UserWarning: You passed a `max_seq_length` argument to the SFTTrainer, the value you passed will override the one in the `SFTConfig`.
  warnings.warn(
/u/choprahetarth/.conda/envs/scoder_2/lib/python3.10/site-packages/trl/trainer/sft_trainer.py:269: UserWarning: You passed a `max_seq_length` argument to the SFTTrainer, the value you passed will override the one in the `SFTConfig`.
  warnings.warn(
/u/choprahetarth/.conda/envs/scoder_2/lib/python3.10/site-packages/trl/trainer/sft_trainer.py:269: UserWarning: You passed a `max_seq_length` argument to the SFTTrainer, the value you passed will override the one in the `SFTConfig`.
  warnings.warn(
/u/choprahetarth/.conda/envs/scoder_2/lib/python3.10/site-packages/trl/trainer/sft_trainer.py:355: UserWarning: You passed a `dataset_kwargs` argument to the SFTTrainer, the value you passed will override the one in the `SFTConfig`.
  warnings.warn(

Map:   0%|          | 0/13721 [00:00<?, ? examples/s]
Map:   7%|▋         | 1000/13721 [00:00<00:08, 1565.88 examples/s]
Map:  22%|██▁       | 3000/13721 [00:00<00:02, 4783.63 examples/s]
Map:  36%|███▋      | 5000/13721 [00:00<00:01, 7764.63 examples/s]
Map:  51%|█████     | 7000/13721 [00:00<00:00, 10391.30 examples/s]
Map:  66%|██████▌   | 9000/13721 [00:01<00:00, 12571.52 examples/s]
Map:  80%|████████  | 11000/13721 [00:01<00:00, 14373.10 examples/s]
Map:  95%|█████████▁| 13000/13721 [00:01<00:00, 15602.23 examples/s]
Map: 100%|██████████| 13721/13721 [00:01<00:00, 10286.08 examples/s]

Map:   0%|          | 0/1525 [00:00<?, ? examples/s]
Map: 100%|██████████| 1525/1525 [00:00<00:00, 15176.35 examples/s]
/u/choprahetarth/.conda/envs/scoder_2/lib/python3.10/site-packages/trl/trainer/sft_trainer.py:355: UserWarning: You passed a `dataset_kwargs` argument to the SFTTrainer, the value you passed will override the one in the `SFTConfig`.
  warnings.warn(
/u/choprahetarth/.conda/envs/scoder_2/lib/python3.10/site-packages/trl/trainer/sft_trainer.py:397: UserWarning: You passed a tokenizer with `padding_side` not equal to `right` to the SFTTrainer. This might lead to some unexpected behaviour due to overflow issues when training a model in half-precision. You might consider adding `tokenizer.padding_side = 'right'` to your code.
  warnings.warn(
/u/choprahetarth/.conda/envs/scoder_2/lib/python3.10/site-packages/trl/trainer/sft_trainer.py:355: UserWarning: You passed a `dataset_kwargs` argument to the SFTTrainer, the value you passed will override the one in the `SFTConfig`.
  warnings.warn(
/u/choprahetarth/.conda/envs/scoder_2/lib/python3.10/site-packages/trl/trainer/sft_trainer.py:355: UserWarning: You passed a `dataset_kwargs` argument to the SFTTrainer, the value you passed will override the one in the `SFTConfig`.
  warnings.warn(
WARNING:accelerate.utils.other:Detected kernel version 4.18.0, which is below the recommended minimum of 5.5.0; this can cause the process to hang. It is recommended to upgrade the kernel to the minimum version or higher.

Map:   0%|          | 0/1525 [00:00<?, ? examples/s]
Map:   0%|          | 0/1525 [00:00<?, ? examples/s]
Map:   0%|          | 0/1525 [00:00<?, ? examples/s]
Map:  66%|██████▌   | 1000/1525 [00:00<00:00, 7271.93 examples/s]
Map:  66%|██████▌   | 1000/1525 [00:00<00:00, 7443.22 examples/s]
Map:  66%|██████▌   | 1000/1525 [00:00<00:00, 6807.06 examples/s]
Map: 100%|██████████| 1525/1525 [00:00<00:00, 8645.79 examples/s]
/u/choprahetarth/.conda/envs/scoder_2/lib/python3.10/site-packages/trl/trainer/sft_trainer.py:397: UserWarning: You passed a tokenizer with `padding_side` not equal to `right` to the SFTTrainer. This might lead to some unexpected behaviour due to overflow issues when training a model in half-precision. You might consider adding `tokenizer.padding_side = 'right'` to your code.
  warnings.warn(

Map: 100%|██████████| 1525/1525 [00:00<00:00, 8808.66 examples/s]
/u/choprahetarth/.conda/envs/scoder_2/lib/python3.10/site-packages/trl/trainer/sft_trainer.py:397: UserWarning: You passed a tokenizer with `padding_side` not equal to `right` to the SFTTrainer. This might lead to some unexpected behaviour due to overflow issues when training a model in half-precision. You might consider adding `tokenizer.padding_side = 'right'` to your code.
  warnings.warn(

Map: 100%|██████████| 1525/1525 [00:00<00:00, 8140.44 examples/s]
/u/choprahetarth/.conda/envs/scoder_2/lib/python3.10/site-packages/trl/trainer/sft_trainer.py:397: UserWarning: You passed a tokenizer with `padding_side` not equal to `right` to the SFTTrainer. This might lead to some unexpected behaviour due to overflow issues when training a model in half-precision. You might consider adding `tokenizer.padding_side = 'right'` to your code.
  warnings.warn(
max_steps is given, it will override any value given in num_train_epochs
max_steps is given, it will override any value given in num_train_epochs
max_steps is given, it will override any value given in num_train_epochs
Training...
Training...
Training...
Training...
wandb: Currently logged in as: hetarthvader. Use `wandb login --relogin` to force relogin
wandb: wandb version 0.17.4 is available!  To upgrade, please run:
wandb:  $ pip install wandb --upgrade
wandb: Tracking run with wandb version 0.17.2
wandb: Run data is saved locally in /scratch/bbvz/choprahetarth/wandb/run-20240709_185926-p05unew0
wandb: Run `wandb offline` to turn off syncing.
wandb: Syncing run train-codegemma-7b
wandb: ⭐️ View project at https://wandb.ai/hetarthvader/huggingface
wandb: 🚀 View run at https://wandb.ai/hetarthvader/huggingface/runs/p05unew0
[rank0]:[W reducer.cpp:1389] Warning: find_unused_parameters=True was specified in DDP constructor, but did not find any unused parameters in the forward pass. This flag results in an extra traversal of the autograd graph every iteration,  which can adversely affect performance. If your model indeed never has any unused parameters in the forward pass, consider turning this flag off. Note that this warning may be a false positive if your model has flow control causing later iterations to have unused parameters. (function operator())
[rank2]:[W reducer.cpp:1389] Warning: find_unused_parameters=True was specified in DDP constructor, but did not find any unused parameters in the forward pass. This flag results in an extra traversal of the autograd graph every iteration,  which can adversely affect performance. If your model indeed never has any unused parameters in the forward pass, consider turning this flag off. Note that this warning may be a false positive if your model has flow control causing later iterations to have unused parameters. (function operator())
[rank3]:[W reducer.cpp:1389] Warning: find_unused_parameters=True was specified in DDP constructor, but did not find any unused parameters in the forward pass. This flag results in an extra traversal of the autograd graph every iteration,  which can adversely affect performance. If your model indeed never has any unused parameters in the forward pass, consider turning this flag off. Note that this warning may be a false positive if your model has flow control causing later iterations to have unused parameters. (function operator())
[rank1]:[W reducer.cpp:1389] Warning: find_unused_parameters=True was specified in DDP constructor, but did not find any unused parameters in the forward pass. This flag results in an extra traversal of the autograd graph every iteration,  which can adversely affect performance. If your model indeed never has any unused parameters in the forward pass, consider turning this flag off. Note that this warning may be a false positive if your model has flow control causing later iterations to have unused parameters. (function operator())
{'loss': 7.6156, 'grad_norm': 4.224548816680908, 'learning_rate': 4e-05, 'epoch': 0.046620046620046623}
{'loss': 3.0387, 'grad_norm': 1.748063325881958, 'learning_rate': 8e-05, 'epoch': 0.09324009324009325}
{'loss': 1.0511, 'grad_norm': 0.7999553084373474, 'learning_rate': 0.00012, 'epoch': 0.13986013986013987}
{'loss': 0.7873, 'grad_norm': 0.6605322957038879, 'learning_rate': 0.00016, 'epoch': 0.1864801864801865}
{'loss': 0.7212, 'grad_norm': 0.605964183807373, 'learning_rate': 0.0002, 'epoch': 0.2331002331002331}
{'loss': 0.6732, 'grad_norm': 0.47547537088394165, 'learning_rate': 0.00019818190089671508, 'epoch': 0.27972027972027974}
{'loss': 0.6532, 'grad_norm': 0.5000079274177551, 'learning_rate': 0.0001927937132738476, 'epoch': 0.32634032634032634}
{'loss': 0.6572, 'grad_norm': 0.520004153251648, 'learning_rate': 0.00018403136231310684, 'epoch': 0.372960372960373}
{'loss': 0.6092, 'grad_norm': 0.43521028757095337, 'learning_rate': 0.0001722134644629807, 'epoch': 0.4195804195804196}
{'loss': 0.5836, 'grad_norm': 0.41130614280700684, 'learning_rate': 0.0001577697419131497, 'epoch': 0.4662004662004662}
{'loss': 0.5731, 'grad_norm': 0.4434795081615448, 'learning_rate': 0.00014122539704393265, 'epoch': 0.5128205128205128}
{'loss': 0.5812, 'grad_norm': 0.4874204993247986, 'learning_rate': 0.00012318201502675285, 'epoch': 0.5594405594405595}
{'loss': 0.5877, 'grad_norm': 0.4201274514198303, 'learning_rate': 0.00010429568899492348, 'epoch': 0.6060606060606061}
{'loss': 0.5792, 'grad_norm': 0.463133305311203, 'learning_rate': 8.525316319690092e-05, 'epoch': 0.6526806526806527}
{'loss': 0.5709, 'grad_norm': 0.46003037691116333, 'learning_rate': 6.674686161423843e-05, 'epoch': 0.6993006993006993}
{'loss': 0.5499, 'grad_norm': 0.40626001358032227, 'learning_rate': 4.944971005318716e-05, 'epoch': 0.745920745920746}
{'loss': 0.5499, 'grad_norm': 0.44683393836021423, 'learning_rate': 3.399066722859782e-05, 'epoch': 0.7925407925407926}
{'loss': 0.5256, 'grad_norm': 0.43750089406967163, 'learning_rate': 2.0931854578410905e-05, 'epoch': 0.8391608391608392}
{'loss': 0.5486, 'grad_norm': 0.4675091803073883, 'learning_rate': 1.0748116414011888e-05, 'epoch': 0.8857808857808858}
{'loss': 0.5411, 'grad_norm': 0.44283339381217957, 'learning_rate': 3.8097536398963963e-06, 'epoch': 0.9324009324009324}
{'loss': 0.5458, 'grad_norm': 0.4453221261501312, 'learning_rate': 3.6905887882213717e-07, 'epoch': 0.9790209790209791}
{'train_runtime': 1034.0676, 'train_samples_per_second': 13.276, 'train_steps_per_second': 0.415, 'train_loss': 1.0616111633105156, 'epoch': 1.0}
GemmaForCausalLM(
  (model): GemmaModel(
    (embed_tokens): Embedding(256000, 3072, padding_idx=0)
    (layers): ModuleList(
      (0-27): 28 x GemmaDecoderLayer(
        (self_attn): GemmaSdpaAttention(
          (q_proj): lora.Linear4bit(
            (base_layer): Linear4bit(in_features=3072, out_features=4096, bias=False)
            (lora_dropout): ModuleDict(
              (default): Identity()
            )
            (lora_A): ModuleDict(
              (default): Linear(in_features=3072, out_features=16, bias=False)
            )
            (lora_B): ModuleDict(
              (default): Linear(in_features=16, out_features=4096, bias=False)
            )
            (lora_embedding_A): ParameterDict()
            (lora_embedding_B): ParameterDict()
          )
          (k_proj): lora.Linear4bit(
            (base_layer): Linear4bit(in_features=3072, out_features=4096, bias=False)
            (lora_dropout): ModuleDict(
              (default): Identity()
            )
            (lora_A): ModuleDict(
              (default): Linear(in_features=3072, out_features=16, bias=False)
            )
            (lora_B): ModuleDict(
              (default): Linear(in_features=16, out_features=4096, bias=False)
            )
            (lora_embedding_A): ParameterDict()
            (lora_embedding_B): ParameterDict()
          )
          (v_proj): lora.Linear4bit(
            (base_layer): Linear4bit(in_features=3072, out_features=4096, bias=False)
            (lora_dropout): ModuleDict(
              (default): Identity()
            )
            (lora_A): ModuleDict(
              (default): Linear(in_features=3072, out_features=16, bias=False)
            )
            (lora_B): ModuleDict(
              (default): Linear(in_features=16, out_features=4096, bias=False)
            )
            (lora_embedding_A): ParameterDict()
            (lora_embedding_B): ParameterDict()
          )
          (o_proj): lora.Linear4bit(
            (base_layer): Linear4bit(in_features=4096, out_features=3072, bias=False)
            (lora_dropout): ModuleDict(
              (default): Identity()
            )
            (lora_A): ModuleDict(
              (default): Linear(in_features=4096, out_features=16, bias=False)
            )
            (lora_B): ModuleDict(
              (default): Linear(in_features=16, out_features=3072, bias=False)
            )
            (lora_embedding_A): ParameterDict()
            (lora_embedding_B): ParameterDict()
          )
          (rotary_emb): GemmaRotaryEmbedding()
        )
        (mlp): GemmaMLP(
          (gate_proj): lora.Linear4bit(
            (base_layer): Linear4bit(in_features=3072, out_features=24576, bias=False)
            (lora_dropout): ModuleDict(
              (default): Identity()
            )
            (lora_A): ModuleDict(
              (default): Linear(in_features=3072, out_features=16, bias=False)
            )
            (lora_B): ModuleDict(
              (default): Linear(in_features=16, out_features=24576, bias=False)
            )
            (lora_embedding_A): ParameterDict()
            (lora_embedding_B): ParameterDict()
          )
          (up_proj): lora.Linear4bit(
            (base_layer): Linear4bit(in_features=3072, out_features=24576, bias=False)
            (lora_dropout): ModuleDict(
              (default): Identity()
            )
            (lora_A): ModuleDict(
              (default): Linear(in_features=3072, out_features=16, bias=False)
            )
            (lora_B): ModuleDict(
              (default): Linear(in_features=16, out_features=24576, bias=False)
            )
            (lora_embedding_A): ParameterDict()
            (lora_embedding_B): ParameterDict()
          )
          (down_proj): lora.Linear4bit(
            (base_layer): Linear4bit(in_features=24576, out_features=3072, bias=False)
            (lora_dropout): ModuleDict(
              (default): Identity()
            )
            (lora_A): ModuleDict(
              (default): Linear(in_features=24576, out_features=16, bias=False)
            )
            (lora_B): ModuleDict(
              (default): Linear(in_features=16, out_features=3072, bias=False)
            )
            (lora_embedding_A): ParameterDict()
            (lora_embedding_B): ParameterDict()
          )
          (act_fn): PytorchGELUTanh()
        )
        (input_layernorm): GemmaRMSNorm()
        (post_attention_layernorm): GemmaRMSNorm()
      )
    )
    (norm): GemmaRMSNorm()
  )
  (lm_head): Linear(in_features=3072, out_features=256000, bias=False)
)
Saving the last checkpoint of the model
saving the model peft layer
GemmaForCausalLM(
  (model): GemmaModel(
    (embed_tokens): Embedding(256000, 3072, padding_idx=0)
    (layers): ModuleList(
      (0-27): 28 x GemmaDecoderLayer(
        (self_attn): GemmaSdpaAttention(
          (q_proj): lora.Linear4bit(
            (base_layer): Linear4bit(in_features=3072, out_features=4096, bias=False)
            (lora_dropout): ModuleDict(
              (default): Identity()
            )
            (lora_A): ModuleDict(
              (default): Linear(in_features=3072, out_features=16, bias=False)
            )
            (lora_B): ModuleDict(
              (default): Linear(in_features=16, out_features=4096, bias=False)
            )
            (lora_embedding_A): ParameterDict()
            (lora_embedding_B): ParameterDict()
          )
          (k_proj): lora.Linear4bit(
            (base_layer): Linear4bit(in_features=3072, out_features=4096, bias=False)
            (lora_dropout): ModuleDict(
              (default): Identity()
            )
            (lora_A): ModuleDict(
              (default): Linear(in_features=3072, out_features=16, bias=False)
            )
            (lora_B): ModuleDict(
              (default): Linear(in_features=16, out_features=4096, bias=False)
            )
            (lora_embedding_A): ParameterDict()
            (lora_embedding_B): ParameterDict()
          )
          (v_proj): lora.Linear4bit(
            (base_layer): Linear4bit(in_features=3072, out_features=4096, bias=False)
            (lora_dropout): ModuleDict(
              (default): Identity()
            )
            (lora_A): ModuleDict(
              (default): Linear(in_features=3072, out_features=16, bias=False)
            )
            (lora_B): ModuleDict(
              (default): Linear(in_features=16, out_features=4096, bias=False)
            )
            (lora_embedding_A): ParameterDict()
            (lora_embedding_B): ParameterDict()
          )
          (o_proj): lora.Linear4bit(
            (base_layer): Linear4bit(in_features=4096, out_features=3072, bias=False)
            (lora_dropout): ModuleDict(
              (default): Identity()
            )
            (lora_A): ModuleDict(
              (default): Linear(in_features=4096, out_features=16, bias=False)
            )
            (lora_B): ModuleDict(
              (default): Linear(in_features=16, out_features=3072, bias=False)
            )
            (lora_embedding_A): ParameterDict()
            (lora_embedding_B): ParameterDict()
          )
          (rotary_emb): GemmaRotaryEmbedding()
        )
        (mlp): GemmaMLP(
          (gate_proj): lora.Linear4bit(
            (base_layer): Linear4bit(in_features=3072, out_features=24576, bias=False)
            (lora_dropout): ModuleDict(
              (default): Identity()
            )
            (lora_A): ModuleDict(
              (default): Linear(in_features=3072, out_features=16, bias=False)
            )
            (lora_B): ModuleDict(
              (default): Linear(in_features=16, out_features=24576, bias=False)
            )
            (lora_embedding_A): ParameterDict()
            (lora_embedding_B): ParameterDict()
          )
          (up_proj): lora.Linear4bit(
            (base_layer): Linear4bit(in_features=3072, out_features=24576, bias=False)
            (lora_dropout): ModuleDict(
              (default): Identity()
            )
            (lora_A): ModuleDict(
              (default): Linear(in_features=3072, out_features=16, bias=False)
            )
            (lora_B): ModuleDict(
              (default): Linear(in_features=16, out_features=24576, bias=False)
            )
            (lora_embedding_A): ParameterDict()
            (lora_embedding_B): ParameterDict()
          )
          (down_proj): lora.Linear4bit(
            (base_layer): Linear4bit(in_features=24576, out_features=3072, bias=False)
            (lora_dropout): ModuleDict(
              (default): Identity()
            )
            (lora_A): ModuleDict(
              (default): Linear(in_features=24576, out_features=16, bias=False)
            )
            (lora_B): ModuleDict(
              (default): Linear(in_features=16, out_features=3072, bias=False)
            )
            (lora_embedding_A): ParameterDict()
            (lora_embedding_B): ParameterDict()
          )
          (act_fn): PytorchGELUTanh()
        )
        (input_layernorm): GemmaRMSNorm()
        (post_attention_layernorm): GemmaRMSNorm()
      )
    )
    (norm): GemmaRMSNorm()
  )
  (lm_head): Linear(in_features=3072, out_features=256000, bias=False)
)
Saving the last checkpoint of the model
saving the model peft layer
GemmaForCausalLM(
  (model): GemmaModel(
    (embed_tokens): Embedding(256000, 3072, padding_idx=0)
    (layers): ModuleList(
      (0-27): 28 x GemmaDecoderLayer(
        (self_attn): GemmaSdpaAttention(
          (q_proj): lora.Linear4bit(
            (base_layer): Linear4bit(in_features=3072, out_features=4096, bias=False)
            (lora_dropout): ModuleDict(
              (default): Identity()
            )
            (lora_A): ModuleDict(
              (default): Linear(in_features=3072, out_features=16, bias=False)
            )
            (lora_B): ModuleDict(
              (default): Linear(in_features=16, out_features=4096, bias=False)
            )
            (lora_embedding_A): ParameterDict()
            (lora_embedding_B): ParameterDict()
          )
          (k_proj): lora.Linear4bit(
            (base_layer): Linear4bit(in_features=3072, out_features=4096, bias=False)
            (lora_dropout): ModuleDict(
              (default): Identity()
            )
            (lora_A): ModuleDict(
              (default): Linear(in_features=3072, out_features=16, bias=False)
            )
            (lora_B): ModuleDict(
              (default): Linear(in_features=16, out_features=4096, bias=False)
            )
            (lora_embedding_A): ParameterDict()
            (lora_embedding_B): ParameterDict()
          )
          (v_proj): lora.Linear4bit(
            (base_layer): Linear4bit(in_features=3072, out_features=4096, bias=False)
            (lora_dropout): ModuleDict(
              (default): Identity()
            )
            (lora_A): ModuleDict(
              (default): Linear(in_features=3072, out_features=16, bias=False)
            )
            (lora_B): ModuleDict(
              (default): Linear(in_features=16, out_features=4096, bias=False)
            )
            (lora_embedding_A): ParameterDict()
            (lora_embedding_B): ParameterDict()
          )
          (o_proj): lora.Linear4bit(
            (base_layer): Linear4bit(in_features=4096, out_features=3072, bias=False)
            (lora_dropout): ModuleDict(
              (default): Identity()
            )
            (lora_A): ModuleDict(
              (default): Linear(in_features=4096, out_features=16, bias=False)
            )
            (lora_B): ModuleDict(
              (default): Linear(in_features=16, out_features=3072, bias=False)
            )
            (lora_embedding_A): ParameterDict()
            (lora_embedding_B): ParameterDict()
          )
          (rotary_emb): GemmaRotaryEmbedding()
        )
        (mlp): GemmaMLP(
          (gate_proj): lora.Linear4bit(
            (base_layer): Linear4bit(in_features=3072, out_features=24576, bias=False)
            (lora_dropout): ModuleDict(
              (default): Identity()
            )
            (lora_A): ModuleDict(
              (default): Linear(in_features=3072, out_features=16, bias=False)
            )
            (lora_B): ModuleDict(
              (default): Linear(in_features=16, out_features=24576, bias=False)
            )
            (lora_embedding_A): ParameterDict()
            (lora_embedding_B): ParameterDict()
          )
          (up_proj): lora.Linear4bit(
            (base_layer): Linear4bit(in_features=3072, out_features=24576, bias=False)
            (lora_dropout): ModuleDict(
              (default): Identity()
            )
            (lora_A): ModuleDict(
              (default): Linear(in_features=3072, out_features=16, bias=False)
            )
            (lora_B): ModuleDict(
              (default): Linear(in_features=16, out_features=24576, bias=False)
            )
            (lora_embedding_A): ParameterDict()
            (lora_embedding_B): ParameterDict()
          )
          (down_proj): lora.Linear4bit(
            (base_layer): Linear4bit(in_features=24576, out_features=3072, bias=False)
            (lora_dropout): ModuleDict(
              (default): Identity()
            )
            (lora_A): ModuleDict(
              (default): Linear(in_features=24576, out_features=16, bias=False)
            )
            (lora_B): ModuleDict(
              (default): Linear(in_features=16, out_features=3072, bias=False)
            )
            (lora_embedding_A): ParameterDict()
            (lora_embedding_B): ParameterDict()
          )
          (act_fn): PytorchGELUTanh()
        )
        (input_layernorm): GemmaRMSNorm()
        (post_attention_layernorm): GemmaRMSNorm()
      )
    )
    (norm): GemmaRMSNorm()
  )
  (lm_head): Linear(in_features=3072, out_features=256000, bias=False)
)
Saving the last checkpoint of the model
saving the model peft layer
GemmaForCausalLM(
  (model): GemmaModel(
    (embed_tokens): Embedding(256000, 3072, padding_idx=0)
    (layers): ModuleList(
      (0-27): 28 x GemmaDecoderLayer(
        (self_attn): GemmaSdpaAttention(
          (q_proj): lora.Linear4bit(
            (base_layer): Linear4bit(in_features=3072, out_features=4096, bias=False)
            (lora_dropout): ModuleDict(
              (default): Identity()
            )
            (lora_A): ModuleDict(
              (default): Linear(in_features=3072, out_features=16, bias=False)
            )
            (lora_B): ModuleDict(
              (default): Linear(in_features=16, out_features=4096, bias=False)
            )
            (lora_embedding_A): ParameterDict()
            (lora_embedding_B): ParameterDict()
          )
          (k_proj): lora.Linear4bit(
            (base_layer): Linear4bit(in_features=3072, out_features=4096, bias=False)
            (lora_dropout): ModuleDict(
              (default): Identity()
            )
            (lora_A): ModuleDict(
              (default): Linear(in_features=3072, out_features=16, bias=False)
            )
            (lora_B): ModuleDict(
              (default): Linear(in_features=16, out_features=4096, bias=False)
            )
            (lora_embedding_A): ParameterDict()
            (lora_embedding_B): ParameterDict()
          )
          (v_proj): lora.Linear4bit(
            (base_layer): Linear4bit(in_features=3072, out_features=4096, bias=False)
            (lora_dropout): ModuleDict(
              (default): Identity()
            )
            (lora_A): ModuleDict(
              (default): Linear(in_features=3072, out_features=16, bias=False)
            )
            (lora_B): ModuleDict(
              (default): Linear(in_features=16, out_features=4096, bias=False)
            )
            (lora_embedding_A): ParameterDict()
            (lora_embedding_B): ParameterDict()
          )
          (o_proj): lora.Linear4bit(
            (base_layer): Linear4bit(in_features=4096, out_features=3072, bias=False)
            (lora_dropout): ModuleDict(
              (default): Identity()
            )
            (lora_A): ModuleDict(
              (default): Linear(in_features=4096, out_features=16, bias=False)
            )
            (lora_B): ModuleDict(
              (default): Linear(in_features=16, out_features=3072, bias=False)
            )
            (lora_embedding_A): ParameterDict()
            (lora_embedding_B): ParameterDict()
          )
          (rotary_emb): GemmaRotaryEmbedding()
        )
        (mlp): GemmaMLP(
          (gate_proj): lora.Linear4bit(
            (base_layer): Linear4bit(in_features=3072, out_features=24576, bias=False)
            (lora_dropout): ModuleDict(
              (default): Identity()
            )
            (lora_A): ModuleDict(
              (default): Linear(in_features=3072, out_features=16, bias=False)
            )
            (lora_B): ModuleDict(
              (default): Linear(in_features=16, out_features=24576, bias=False)
            )
            (lora_embedding_A): ParameterDict()
            (lora_embedding_B): ParameterDict()
          )
          (up_proj): lora.Linear4bit(
            (base_layer): Linear4bit(in_features=3072, out_features=24576, bias=False)
            (lora_dropout): ModuleDict(
              (default): Identity()
            )
            (lora_A): ModuleDict(
              (default): Linear(in_features=3072, out_features=16, bias=False)
            )
            (lora_B): ModuleDict(
              (default): Linear(in_features=16, out_features=24576, bias=False)
            )
            (lora_embedding_A): ParameterDict()
            (lora_embedding_B): ParameterDict()
          )
          (down_proj): lora.Linear4bit(
            (base_layer): Linear4bit(in_features=24576, out_features=3072, bias=False)
            (lora_dropout): ModuleDict(
              (default): Identity()
            )
            (lora_A): ModuleDict(
              (default): Linear(in_features=24576, out_features=16, bias=False)
            )
            (lora_B): ModuleDict(
              (default): Linear(in_features=16, out_features=3072, bias=False)
            )
            (lora_embedding_A): ParameterDict()
            (lora_embedding_B): ParameterDict()
          )
          (act_fn): PytorchGELUTanh()
        )
        (input_layernorm): GemmaRMSNorm()
        (post_attention_layernorm): GemmaRMSNorm()
      )
    )
    (norm): GemmaRMSNorm()
  )
  (lm_head): Linear(in_features=3072, out_features=256000, bias=False)
)
Saving the last checkpoint of the model
saving the model peft layer
/u/choprahetarth/.conda/envs/scoder_2/lib/python3.10/site-packages/huggingface_hub/file_download.py:1132: FutureWarning: `resume_download` is deprecated and will be removed in version 1.0.0. Downloads always resume when possible. If you want to force a new download, use `force_download=True`.
  warnings.warn(
/u/choprahetarth/.conda/envs/scoder_2/lib/python3.10/site-packages/huggingface_hub/file_download.py:1132: FutureWarning: `resume_download` is deprecated and will be removed in version 1.0.0. Downloads always resume when possible. If you want to force a new download, use `force_download=True`.
  warnings.warn(
/u/choprahetarth/.conda/envs/scoder_2/lib/python3.10/site-packages/huggingface_hub/file_download.py:1132: FutureWarning: `resume_download` is deprecated and will be removed in version 1.0.0. Downloads always resume when possible. If you want to force a new download, use `force_download=True`.
  warnings.warn(
/u/choprahetarth/.conda/envs/scoder_2/lib/python3.10/site-packages/huggingface_hub/file_download.py:1132: FutureWarning: `resume_download` is deprecated and will be removed in version 1.0.0. Downloads always resume when possible. If you want to force a new download, use `force_download=True`.
  warnings.warn(
Deleted all GPU Memory
Merging the Lora layers back
Deleted all GPU Memory
Merging the Lora layers back
Deleted all GPU Memory
Merging the Lora layers back
Deleted all GPU Memory
Merging the Lora layers back

Loading checkpoint shards:   0%|          | 0/4 [00:00<?, ?it/s]
Loading checkpoint shards:   0%|          | 0/4 [00:00<?, ?it/s]
Loading checkpoint shards:   0%|          | 0/4 [00:00<?, ?it/s]
Loading checkpoint shards:   0%|          | 0/4 [00:00<?, ?it/s]
Loading checkpoint shards:  25%|██▌       | 1/4 [00:04<00:13,  4.36s/it]
Loading checkpoint shards:  25%|██▌       | 1/4 [00:04<00:13,  4.37s/it]
Loading checkpoint shards:  25%|██▌       | 1/4 [00:04<00:13,  4.41s/it]
Loading checkpoint shards:  25%|██▌       | 1/4 [00:04<00:13,  4.36s/it]
Loading checkpoint shards:  50%|█████     | 2/4 [00:08<00:08,  4.37s/it]
Loading checkpoint shards:  50%|█████     | 2/4 [00:08<00:08,  4.36s/it]
Loading checkpoint shards:  50%|█████     | 2/4 [00:08<00:08,  4.38s/it]
Loading checkpoint shards:  50%|█████     | 2/4 [00:08<00:08,  4.36s/it]
Loading checkpoint shards:  75%|███████▌  | 3/4 [00:13<00:04,  4.37s/it]
Loading checkpoint shards:  75%|███████▌  | 3/4 [00:13<00:04,  4.35s/it]
Loading checkpoint shards:  75%|███████▌  | 3/4 [00:13<00:04,  4.37s/it]
Loading checkpoint shards:  75%|███████▌  | 3/4 [00:13<00:04,  4.36s/it]
Loading checkpoint shards: 100%|██████████| 4/4 [00:15<00:00,  3.40s/it]
Loading checkpoint shards: 100%|██████████| 4/4 [00:15<00:00,  3.76s/it]
Loading PEFT model...

Loading checkpoint shards: 100%|██████████| 4/4 [00:14<00:00,  3.36s/it]
Loading checkpoint shards: 100%|██████████| 4/4 [00:14<00:00,  3.73s/it]

Loading checkpoint shards: 100%|██████████| 4/4 [00:15<00:00,  3.39s/it]
Loading checkpoint shards: 100%|██████████| 4/4 [00:15<00:00,  3.75s/it]
Loading PEFT model...

Loading checkpoint shards: 100%|██████████| 4/4 [00:14<00:00,  3.38s/it]
Loading checkpoint shards: 100%|██████████| 4/4 [00:14<00:00,  3.74s/it]
Loading PEFT model...
Loading PEFT model...
Merging and unloading model...
Loading tokenizer...
Merging and unloading model...
Merging and unloading model...
Loading tokenizer...
Merging and unloading model...
Loading tokenizer...
Loading tokenizer...
Saving pretrained model and tokenizer...
Saving pretrained model and tokenizer...
Saving pretrained model and tokenizer...
Saving pretrained model and tokenizer...
Training Done! 💥
wandb: - 0.008 MB of 0.008 MB uploaded
wandb: \ 0.037 MB of 0.059 MB uploaded (0.003 MB deduped)
wandb: | 0.059 MB of 0.059 MB uploaded (0.003 MB deduped)
wandb: 
wandb: Run history:
wandb:         train/epoch ▁▁▂▂▂▃▃▃▄▄▄▅▅▅▆▆▆▇▇███
wandb:   train/global_step ▁▁▂▂▂▃▃▃▄▄▄▅▅▅▆▆▆▇▇███
wandb:     train/grad_norm █▃▂▁▁▁▁▁▁▁▁▁▁▁▁▁▁▁▁▁▁
wandb: train/learning_rate ▂▄▅▇███▇▇▇▆▅▅▄▃▃▂▂▁▁▁
wandb:          train/loss █▃▂▁▁▁▁▁▁▁▁▁▁▁▁▁▁▁▁▁▁
wandb: 
wandb: Run summary:
wandb:               total_flos 8.078677925429248e+16
wandb:              train/epoch 1.0
wandb:        train/global_step 429
wandb:          train/grad_norm 0.44532
wandb:      train/learning_rate 0.0
wandb:               train/loss 0.5458
wandb:               train_loss 1.06161
wandb:            train_runtime 1034.0676
wandb: train_samples_per_second 13.276
wandb:   train_steps_per_second 0.415
wandb: 
wandb: 🚀 View run train-codegemma-7b at: https://wandb.ai/hetarthvader/huggingface/runs/p05unew0
wandb: ⭐️ View project at: https://wandb.ai/hetarthvader/huggingface
wandb: Synced 5 W&B file(s), 0 media file(s), 2 artifact file(s) and 0 other file(s)
wandb: Find logs at: /scratch/bbvz/choprahetarth/wandb/run-20240709_185926-p05unew0/logs
wandb: WARNING The new W&B backend becomes opt-out in version 0.18.0; try it out with `wandb.require("core")`! See https://wandb.me/wandb-core for more information.
Training Done! 💥
Training Done! 💥
Training Done! 💥


srun --unbuffered --account=bbvz-delta-gpu \
python -m torch.distributed.run \
--nproc_per_node=4 \
finetune.py \
--model_id="google/codegemma-7b" \
--dataset_name="/u/choprahetarth/all_files/data/train_ftdata-new-small.json" \
--max_seq_length 512 \
--max_steps 429 \
--size_valid_set 1525 \
--micro_batch_size 2 \
--gradient_accumulation_steps 4 \
--weight_decay 0.01 \
--fp16 True \
--lora_rank 16 \
--learning_rate 2e-4 \
--lr_scheduler_type="cosine" \
--warmup_steps 100 \
--seed 1234 \
--output_dir="//scratch/bbvz/choprahetarth/starcoder2_script/codegemma-7b" \
--push_to_hub False \
--save_freq 20